"March 30, 2020",Pretty sturdy so far,"By my wife: Bought this clear case for iPhone 11 and it has held up so far pretty well since I bought it 1st week of Feb; its fallen quite a few times. I have always used a big name brand solid color case for my iPhones and this time, since I got a beautiful seafoam green, it felt like a shame to hide it. So I decided to give this a try without breaking the bank. And I am happy with it so far, especially because I did not pay $35 or more for it. Here's to hoping it holds up for much longer.",5.0,positive
"March 29, 2020",Love my case,Great case and easily fits in my pocket,5.0,positive
"March 29, 2020",Good value,Price is good and works well overall what I’d hoped for.,5.0,positive
"March 28, 2020",Beautiful with my Red iPhone!,"I was debating between getting either the red or black version of this case, but I ended up getting a black case after looking at some of the pictures.  I cannot be happier with it! Absolutely stunning case that I get compliments on wherever I go.  I also like that it is pretty durable too, I have dropped it a few times with nothing really happening to it.  One thing that is not the best would be that dust tends to get under the cover, but it is pretty easy to clean!",5.0,positive
"March 28, 2020",Buy!,Honestly didn’t think this case would protect my phone but it does! Definitely a great purchase.,4.0,positive
"March 28, 2020",Incorrect description,The case serves its purpose... but the description says ‘matte black case’ and the only part of it that’s black is the outside edge of the case.. the rest of it is clear.. I was very disappointed.,1.0,negative
"December 16, 2019",Would buy again,Works wellAnd it’s sturdyI have dropped my phone lots of times and it’s still holding up pretty goodIf you want something light weight this should be good just keep in minds it’s not a heavy duty case,5.0,positive
"December 16, 2019",Great product for the price!,I’m prone to dropping my phone and I really think this case protects everything it needs to. I’ve had it for about a month and I love it!,5.0,positive
"December 16, 2019",Spigen,Me gusta la resistencia y el diseño,5.0,positive
"December 16, 2019",It okay.,Does not really protect the phone and the case gets dirty and scratched.,4.0,positive
"December 16, 2019",Pensé que era para normal como se veía en la foto y es para iPhone 11 pro,Es para iPhone 11pro,1.0,negative
"December 16, 2019",Thin,Protects well enough I drop at least 5 times a day on to tile or concrete,5.0,positive
"December 16, 2019",Great Case,"Fits well and looks great. Another great case from Spigen. I haven’t gotten the chance to test the durability yet, but I’m sure it will protect my phone when the time comes.",5.0,positive
"December 16, 2019",Does not include....,This cover is very durable and price is fair. From the pictures I was under the impression that a screen protector was included. It was not. Without a pop-socket I did find it a little slippery when talking. Otherwise this product is a durable case.,4.0,positive
"December 16, 2019",Sturdy Case,This case is great. I’ve dropped my phone several times already(oops) but this case has procreated it very well!,5.0,positive
"December 16, 2019","Very sturdy, especially for the price.",Dropped my phone 5 times already. This case keeps it protected.,5.0,positive
"December 16, 2019",Good case,This is my second time ordering a case wit this brand name. 2 different devices.  Definitely worth the money.  Only thing I see is that I put my phone in my back pocket with blue jeans on  and it turned the rim of the phone case blue nothing wrong with that.,5.0,positive
"December 16, 2019","well built, nice style","I have owned spigen cases before, they are always my best choice, price is good and quality is great.",5.0,positive
"December 16, 2019",Amazing Quality,Loved the black border and the hard see thru plastic and how it doesn’t get dirty,5.0,positive
"December 15, 2019",Clear back - high quality!,Didn’t realize the whole back or case is clear when purchasing. My mistake. Worked out well though - case serves its purpose well.,5.0,positive
"December 15, 2019",Works well,Works and looks great! I like spigen products!! The only thing that could Be better is fingerprint resistance.....but not too bothersome especially in this clear color.,5.0,positive
"December 15, 2019",Very good product,Very happy,5.0,positive
"December 15, 2019",Good price,Excellent product,5.0,positive
"December 15, 2019",Love spigen phone cases,All I buy is spigen products for my electronics. Great quality!,5.0,positive
"December 15, 2019",As described,"As expected, very nice",5.0,positive
"December 15, 2019",Good simple basic case.,Simple case to protect the phone from falls. Seems good so far.,5.0,positive
"December 15, 2019",Great case,Slim and great fit,5.0,positive
"December 15, 2019",Great...,"Great Case, And Price..",5.0,positive
"December 15, 2019","Decent protective case, but scratches easily","Good and protective case, but began yellowing quickly after I got it and is extremely prone to scratching.",3.0,negative
"December 15, 2019",Great quality slim design,"I had this same case on my iphone X for 2 years, the new one for the iphone 11 fits like a glove.  Very satisfied.",5.0,positive
"December 15, 2019",Good for price,"Nice, cheap but the case scratches easily.",4.0,positive
"December 15, 2019",Recommend,Love it,5.0,positive
"December 15, 2019",It’s a ok product but I want better,It’s ok just isn’t what I expected,4.0,positive
"December 15, 2019",It is as advertised,It was what I expected.  I hope it withstands the test of time.,5.0,positive
"December 15, 2019",Best brand of cell phone case out there.,"I seek out this same brand when I need a new phone case as they are always perfect fit, durable and attractive. This one is no different. It’s on an iPhone 11. The phone has been dropped in the case (corner and face impact) and no problems. This brand is far less expansive than otter box.",5.0,positive
"December 15, 2019",Nice looking,Strong,5.0,positive
"December 15, 2019",Good choice,I had one one my last phone for 2 years. Great case and not expensive.,5.0,positive
"December 14, 2019",Overrated,"The sidewall is too high and the phone sits too deep. The edges have some sharpNess to it, so returning.",1.0,negative
"December 14, 2019",Best for the price,"Easy to install, no issues at all. Looks good on my phone. Phone doesn’t look bulky like it does with some other cases. Have used spigen cases previously and they have saved my phones all the times. Hope this one does the same when it comes to that.",5.0,positive
"December 14, 2019",Doesn’t yellow,Stays clear,4.0,positive
"December 14, 2019",Fabulous!,"Fabulous!!!!! I was skeptical because it was so much cheaper than the other cases, but thank goodness I got it!!! It's perfect!...exactly as described! Get it! Get it! Get it!",5.0,positive
"December 14, 2019",Perfect case.,Light weight and really keeps your phone protected.,5.0,positive
"December 14, 2019",Sleek yet protective case!,People are upset about the branding on the case. It’s not that big of a deal. This is a good protective case and that’s what matters!,5.0,positive
"December 14, 2019",Great phone case,Great product!,5.0,positive
"December 14, 2019",Buen material me encanto,Excelente case me encanto,5.0,positive
"December 14, 2019",Love this!!,Great cover!! Clear so it shows all the color of my new phone,5.0,positive
"December 14, 2019",Shows off the phone color,Lovely case,4.0,positive
"December 14, 2019",Nice case to show your new phone!,"Fits well! I can imagine the clear  plastic yellowing in time. But for the price, very nice!",4.0,positive
"December 14, 2019",Apple iPhone 11 Case,LIght weight and comfortable iPhone case.,5.0,positive
"December 14, 2019",Nice Purchase,Great quality and good case,5.0,positive
"December 14, 2019",Great,"Great case,very nice",5.0,positive
"December 14, 2019",Strong case,Affordable and strong case.,5.0,positive
"December 14, 2019",Fits like a glove,Great fit and protection,4.0,positive
"December 14, 2019",Great purchase,Great quality and fit,5.0,positive
"December 14, 2019",Great purchase,"Feels durable, looks good, easy to clean. I’ll probably stick with this brand going forward",5.0,positive
"December 14, 2019",Good Quality,Good product,4.0,positive
"December 13, 2019",Very handy,Holds plenty of cards securely and didn’t stretch out like my previous ones,5.0,positive
"December 13, 2019",Very easy to hold,"This product works very well and has saved my phone many times. On a few occasions while carrying in my back pocket, a corner of the protector did slightly come off. I just had to slightly push it back on. It is not a big and bulky protector. It also helps keep the phone from being so slippery.",5.0,positive
"December 13, 2019",Clean look.,Nice and sleek design!,5.0,positive
"December 13, 2019",Design,I love it❤️,5.0,positive
"December 13, 2019",Great value,Looks good.  Fits well on the phone.,5.0,positive
"December 13, 2019",Best product,Strong and easy to install,5.0,positive
"December 13, 2019",Great,Great,5.0,positive
"December 13, 2019",Good case with bad film protector on,Let me just say I’ve always been a fan of SPIGEN CASES! They are so durable and no matter how I drop my phone. They never crack on me. However this phone cover has the worst film packaging design ever. It took me 10 minutes just to peel the film off on both sides. There’s no tabs on it to make it easier to peel off the packaging. I had to use my nails on the corners just to peel it off. Very frustrating.,4.0,positive
"December 13, 2019",Great value,Great case for phone,5.0,positive
"December 13, 2019",Broken,Bad it came broken,1.0,negative
"December 13, 2019",Great for the price,Keeps my screen looking good and isn’t bulky.,5.0,positive
"December 13, 2019",Excellent. Secure fit. Resists scratches.,"Excellent product. Nice soft touch plastic that resists scratches. Perfect size. Easy to carry, secure fit, protects from impact. The best iPhone case I’ve tried.",5.0,positive
"December 13, 2019",It was hard to remove the screen guard from the case. But once fixed it is amazing I love it.,It is very sturdy and I don't need a separate screen protector.,5.0,positive
"December 13, 2019",Eh,"Case is nice. Holds phone but if phone falls, I can still see it cracking.",3.0,negative
"December 13, 2019",HAVE TO BUY - MUST HAVW,LOVE! I drop my phone so many times and I needed a really nice case and this was it!!,5.0,positive
"December 13, 2019",Nice Case for iPhone 11,"When you buy a color iPhone, you want to see that color. Love the clear case with the rubberized ""bumper"" surrounding the edges. Very easy to insert or remove the phone if you want to change the case out, as opposed to OtterBox which I found to be a bit tough to do. Once the phone is inserted, though, it's very secure. Charging cord or headphone plug fits easily and side buttons work seamlessly. Nice color selection, too (but I prefer the clear for my lavender phone).",5.0,positive
"December 13, 2019",Could be better,Very slippery but it will protect if you drop the phone.,3.0,negative
"December 13, 2019",Very nice,It’s really good,5.0,positive
"December 13, 2019",hard to peel off the protective film from case lol,"made well, I like the raised edges to help protect my $$ phone.",5.0,positive
"December 13, 2019",Excelente,Cubre perfecto los bordes,5.0,positive
"December 13, 2019",Amazing,Value for money!,5.0,positive
"December 12, 2019",Very good,Quality and protection is good. The price is also good and I recommend,5.0,positive
"December 12, 2019",Great case!,"I love that this clear case still let’s the pretty color of my phone show through. I’ve already dropped my phone several times and it has held up so well. The lip on the front side is great and protects your screen from touching surfaces. It’s not too slippery and has a pretty good grip factor when you hold it. So far there has been no discoloration of the clear turning a yellow or anything like that. I’m pretty rough with my phone... as a preschool teacher I’m constantly using my phone during messy activities and the such, and it’s been great through it all! Highly recommend this case to anyone who wants a simple no frills case!",5.0,positive
"December 12, 2019",Great case,I have dropped it quite a bit and nothing has happened to it. Love it definitely recommend it.,5.0,positive
"December 12, 2019",Sturdy,It’s great.,5.0,positive
"December 12, 2019",The best case,Alaays number 1 in cases,5.0,positive
"December 12, 2019",Will protect your investment,Docked one star due to the removal process of the stickers.  Purchased 2 of these and it took 10 minutes each to carefully remove the protective film.  Why not just place a tab on it.Love spigen cases otherwise.,4.0,positive
"December 12, 2019",Good Case,Good case I recommend it but it collects dust inside case and it gets a little scratchy easily.,5.0,positive
"December 12, 2019",Love my clear case,It still looks new,5.0,positive
"December 12, 2019",Typical great Spigen quality again.,"I have been a fan of Spigen iPhone cases for sometime now and this iPhone 11 model doesn't disappoint.  Easy to install on phone with a perfect fit.  IPhone buttons work well, as they should.  Very slim case keeping the overall size comfortable to use.  Offers good protection for the camera lenses.  I would buy again.",5.0,positive
"December 12, 2019",Protects the phone well,I can relax now that I don’t have to worry about my son dropping and cracking the screen or back glass on his phone,5.0,positive
"December 12, 2019",nice product,nice product,4.0,positive
"December 12, 2019",Great buy!,Pretty great. No complaints here. Very easy to wipe down when needed. Can’t be the price!,5.0,positive
"December 12, 2019",Great Product!,"I love it, it looks great!",5.0,positive
"December 12, 2019",Nice Sleek design,Easy to install and very sturdy,5.0,positive
"December 12, 2019",Thanks Spigen!,No worries this is not ugly as you think.,5.0,positive
"December 12, 2019",Great buy!,"Love this item, worth the price. Fits perfectly on my iPhone 11.",5.0,positive
"December 12, 2019",Not so clean looking case,"It’s nice case however, you can clearly see all the hand and finger marks on the back of case which makes your case look dirty.",3.0,negative
"December 12, 2019",Perfect,Great case,5.0,positive
"December 12, 2019",The back of the case is clear!,Great price and a great product! The rear of the case is clear so it shows off the color of your phone.,5.0,positive
"December 12, 2019",Protection is 5 stars,"I really like the protectiveness of this case, however, it does not stay clear, it yellows over time. I am a little disappointed as I have never found a clear case that stays clear. Even with regular cleaning it still yellowed. But it’s very sturdy and protects as it should, and that’s good enough for me!",4.0,positive
"December 12, 2019",I love it,It’s a nice sturdy case,5.0,positive
"December 12, 2019",Case11,"The writing from the rape was still on case after removing the tape, that’s the only issue",5.0,positive
"December 12, 2019",Case/price,Great case great price,5.0,positive
"December 12, 2019",Good product.. perfect fir for Iphone 11,Really nice case. Fast shipping. Fits perfectly.I dropped my phone couple of times and my gorilla glass cracked but nothing happened to my phone.This case save my phone.,5.0,positive
"December 12, 2019",Great quality for the price,Better than Apple clear case,5.0,positive
"December 12, 2019",Favorite phone case,I purchased this brand’s clear case for my iPhone 6S 4 years ago and it held up great. Ordered the same thing for my iPhone 11 and i’m very happy with it and it seems like it will last just as long as my previous case.,5.0,positive
"December 12, 2019",Must have for iphone,Great product at a great price.  Might have preferred a different color,5.0,positive
"December 12, 2019",Spigen Ultra Hybrid iPhone 11 case,"Likes: looks good, feels great in hand, easy to grip, easy to put on and take offDislikes: non",5.0,positive
"December 12, 2019",Nice looking case but comes with a flaw,This is my third Spigen case for iPhones. The case looks and feels ok. I haven’t dropped myphone yet so I can’t say just how much protection it actually gives. As always I like the price compared to the competitors. One thing I didn’t like is the film they attach to the inside and outside of the back of the case that needed to be removed prior to using. I get that it’s to keep the case from getting scratched up while inside the box but maybe Spigen should have put pull tabs on it to make it easier to remove. I scratched both inside and outside the case trying to remove the protective plastic so that’s a bummer. I would’ve returned it instantly if my son hadn’t already ripped up the box that it came in as I didn’t like that I had to scratch the case with my finger nails to remove the protective plastic. Also the case is a clear case even though I ordered Matte black. Only the sides of the case are Matte Black so that was a little misleading.,3.0,negative
"March 27, 2020",Black case is not all black. It has a clear back which I hoped for,Bombastic,5.0,positive
"March 27, 2020",Always good,Always good,5.0,positive
"March 27, 2020",Easy to hold,"This case for Apple Iphone 11 is easy to hold, uses durable and long lasting. It is also good for price.",5.0,positive
"March 27, 2020",Case,Case,5.0,positive
"March 27, 2020",Happy with my choice,I remain happy with this case. It continues to look good and protect my lovely red phone. No yellowing and not too bad with fingerprints.,5.0,positive
"March 27, 2020",Great Purchase,Simple and minimal look just like I like it. Love that it’s raised slightly higher than the screen so if myPhone falls flat the screen doesn’t hit the ground.,5.0,positive
"March 26, 2020",Great price great product,Love this product - please take note the back is clear and not solid black,5.0,positive
"March 26, 2020",Satisfied.,Personal cell phone.,4.0,positive
"March 26, 2020",Purple iPhone case,Wanted a clear case for wife’s purple phone. Spigen has a great reputation. She loves it.,5.0,positive
"March 26, 2020",Perfect,Not too sticky; not too slippery.,5.0,positive
"December 12, 2019",Love it . Love the price,Love,5.0,positive
"December 12, 2019",Working well so far,"Several hard drops from 3-4’ high so far, phone is still fine",5.0,positive
"December 11, 2019",Great product,"Fits perfectly, looks great",5.0,positive
"December 11, 2019",Good,Good,5.0,positive
"December 11, 2019",Nice case - like the bumpers,"I can’t speak to the drop test yet but I like that it has bumpers around the camera, and on the back corners. Light, sturdy and chic",5.0,positive
"December 11, 2019",Sleek and durable,"Perfect amount of protection without being too bulky! I’ve already dropped my new phone a handful of times, and this case has the perfect amount of lip along the edges to raise my screen from a hard surface, resulting in no cracks!",5.0,positive
"December 11, 2019",Awesome,"Cost effective, simple, holds up great.",5.0,positive
"December 11, 2019",Decent,Good,5.0,positive
"December 11, 2019",Functional,Value,5.0,positive
"December 11, 2019",Not a reliable product,Cracked my iPhone 11 screen within first week of putting this screen guard. I bought this after seeing my 5 star reviews but all those 5 star reviews seems to be misleading. I would not recommend it to others.,3.0,negative
"December 11, 2019",It was exactly what I was looking for!,"This is what I like-It is completely clear, no yellowish color so far.-It is sturdy and feels strong enough to protect the phone-It is raced on the edges to protect the camera and the front of the body.-It gives much better coverage to your phone than the one on the apple store.-It's a great price for a great product",5.0,positive
"December 11, 2019",Very nice case!,Case fits snug and made it here on time. Will use seller again!,5.0,positive
"December 11, 2019",Nice,Nice,5.0,positive
"December 11, 2019",Great Case!,Love my case! I finally feel my phone is safe again! I have 4 kids so this was a huge need.,5.0,positive
"December 11, 2019",Spigen is trustworthy and good looking,Such a great case! Previously used a Spigen case 5 years on my iPhone 6 and just upgraded to the 11. The clear case looks great with my red phone and my wife’s green phone. The rim around the front really protects the screen from getting damaged during falls unlike other brands on here. Highly recommended,5.0,positive
"December 11, 2019",Good case,Good,4.0,positive
"December 11, 2019",Great for price,"Fits great, great price, love the clear",5.0,positive
"December 11, 2019",great protection,"sleek design, great ptotection",5.0,positive
"December 11, 2019",Love it!!!,I love this case!! Looks great on my phone!!,5.0,positive
"December 10, 2019",Good phone cover,Awesome as usual,5.0,positive
"December 10, 2019",Elegant but slippery,"Sturdy case but slippery! I had to add a popsocket to make sure I can hold the phone without it skipping out of my hands. It's very sturdy though, and has held up well.",4.0,positive
"December 10, 2019",Easy to use,Product fits my phone perfectly and feels very durable.,5.0,positive
"December 10, 2019",Flexibility,"Easy to use, to clean",4.0,positive
"December 10, 2019",nice looking,nice,5.0,positive
"December 10, 2019","Best case ever, very protective.","Best case ever!! I Had it with my iPhone 8. And now with my iPhone 11. I’ve bought it for my niece. My brother. And my sister in law. And the best part?? It’s terrible-twos proof, lol. Parents will understand! My son throws my phone sometimes in a middle of a tantrum or drops it by accident. And the phone does not break. This case is seriously the best case I’ve ever had.",5.0,positive
"December 10, 2019",Great phone case!,This case is great I would definitely buy this brand again for sure.,5.0,positive
"December 10, 2019","Sturdy, reliable, and well designed","I have been buying spigen products since my I got my galaxy s5. These cases look nice and keep your phone protected from the worst drops. I have never cracked a phone with one of these cases on my phone. Buttons are nice and clicky which I find very nice from a case. A $40 case for the 11 doesn’t have nice clicky buttons, but this does. Overall nice case and great price.",5.0,positive
"December 10, 2019",Good product for a good price,Very good stuff,5.0,positive
"December 10, 2019",thanks,i like it,5.0,positive
"December 10, 2019",Perfect for a phone,Perfect,5.0,positive
"December 10, 2019",Buy it,"This case is great. I’ve dropped my phone a few times and nothing’s happened. Works well with my screen protector. Easy to grip. Hasn’t scratched. The only criticism I have is that the bottom isn’t open like on the Apple silicon cases. I love that feature because it makes it a little easier to hold for me. But other than that, I recommend this case. I’ve been using it for over 2 months and I’d buy it again.",5.0,positive
"December 10, 2019",Great case,Great case to dhow off the phone!,5.0,positive
"December 10, 2019",Super duper,So good u can wipe my ass with it,5.0,positive
"December 10, 2019",Good quality and cheaper here than the store,Like it.,5.0,positive
"December 10, 2019",Not what I thought it would be,Not what I thought it would be at all.,3.0,negative
"December 10, 2019",Dirt and fingerprint magnet BUT protects device well,The case smudges no matter how clean. The clear style is very much a smudge and dirt magnet. If looks don’t matter this is a great case. Have dropped many times and spigen always has a durable product to protect your device. /(iPhone 11),3.0,negative
"December 10, 2019",👍,"Very nice case, soft but also sturdy. The clear one is very pretty and fits the phone perfectly. It’s quite a thick case though.",5.0,positive
"December 10, 2019",Decent product,Does its job. Pretty good at shock absorbtion.,5.0,positive
"December 10, 2019",Strongg,Quality is very good,5.0,positive
"December 10, 2019",No,No,5.0,positive
"December 10, 2019",Case,Nice,5.0,positive
"December 10, 2019",Don’t buy,It looks dirty with finger tips and scratches easily,1.0,negative
"December 10, 2019",Better than phone covers costing 3X as much.,"Perfect fit....quality excellent...looks like it came with the iPhone 11...bought 2, clear and matte black, perfect ! Packaged well and shipped quickly.",5.0,positive
"December 10, 2019",Good value for money but nothing exceptional,Good but nothing exceptional. Good value for money. Case would be more protective if had shock absorbers on the corners.,5.0,positive
"December 10, 2019",Slimey - I don't like it :),"Don't like, but I'm sure it's just me. When the phone gets hot, and my hands get greasy, it's just a mess. Ha!",3.0,negative
"December 9, 2019",Goof,Good,5.0,positive
"December 9, 2019",Nice case,Very inexpensive good case,4.0,positive
"December 9, 2019",Perfect,See title,5.0,positive
"December 9, 2019",Good Quality,"So far it’s been awesome! When I first saw it I wasn’t sure it would protect my phone well, but it has! I love that it’s clear! I’ve dropped my phone and it’s protected it.",5.0,positive
"December 9, 2019",Slips and Slides - drops to the floor just like al the others,I bought this item because I hoped it would not slide on surfaces and slip to the floor as easily as other clear phone protectors I have bought. It's a big disappointment. It's no better than the knockoff I bought from a kiosk at the mall. Wasted my money.,2.0,negative
"December 9, 2019",Sleek and I like the way the buttons feel.,"I like the clear back, shows the Apple sign. Looks nice.",5.0,positive
"December 9, 2019",Great.,"Just a great case, as usual though.",5.0,positive
