"March 2, 2020",Really nice case,Teally nice case with an economical price!,5.0,positive
"March 2, 2020",Protects Case,"My husband needed a phone case. There were too many options. After reading several reviews I bought this one. He really likes it. No complaints. Easy to hold, not slippery. Hasn't dropped the phone yet, so can't speak to its protectiveness...yet.",4.0,positive
"March 2, 2020",I’m just trying it.,It looks great. Let’s see it’s durability,5.0,positive
"March 2, 2020",Just perfect!,I had ordered another clear case 2 weeks earlier. It’s edges wrapped around the front slightly and a screen protector wouldn’t work. I messed up 3 before I gave up.  This one is perfect!,5.0,positive
"March 2, 2020",Pretty good for the price,This is a pretty nice slim case it’s hard front an back but just enough flexible for your phone to get in easily it’s really nice,5.0,positive
"March 2, 2020",Good cases,Always buy spigen cases.,5.0,positive
"March 2, 2020",Great Protection,Well designed. Had one on the previous phone for 3 years and never an issue,5.0,positive
"March 2, 2020",quality,phone cover,5.0,positive
"March 2, 2020",Great phone case,Great,5.0,positive
"March 2, 2020",Great cases,"Great case, great company. I’ve bought and used spigen brand cases on all my phones including my last phone the Note 8. I’ve dropped my phone many times and these cases have protected my phone all the time",5.0,positive
"March 2, 2020",Great Product,Exactly what I was looking for.  Very sturdy and durable,5.0,positive
"March 1, 2020",Great,Really durable holds to Average drops,5.0,positive
"March 1, 2020","Nice, durable, easy to install",Packaging was very nice. Easy to install with clear instructions. I am happy with this purchase.,5.0,positive
"May 3, 2020",Snug as a bug,"The iPhone is so slippery it falls off a lot of things, is even difficult to hold at times. This case keeps my phone from falling now and fits my phone snug as a bug, good product in my humble opinion.",5.0,positive
"May 2, 2020",It’s a good product,The back of case is clear.,4.0,positive
"May 2, 2020",Highly recommended case!,"I was skeptical with how cheap the case was BUT it exceeded my expectations by far! Looks great, feels awesome and offers complete protection even for the camera housing that sticks out. I understand why there’s so many good reviews.",5.0,positive
"May 2, 2020",Flimsy not sturdy enough,"This was a gift, and I was told that it is NOT sturdy enough for the IPhone 11. She said it is flimsy.",2.0,negative
"May 2, 2020","Good case, but picture played me","Overall case is great yk, if you want a clear case wit matte framing. Because that’s what this is. Otherwise If you want a full blown BLACK MATTE case, this ain’t it. But 10/10 for construction and level of protection.",4.0,positive
"May 1, 2020",Better than I remember,"So I will start of by saying that I got a new phone in Feb. I went from the 8 to the 11 due to phone failure. I had this case for my 8 but decided to go originally for a speck case for my 11. I am not gentle with my phones (at work I tend to drop it as I do a lot of physical construction work) and therefore tend to like to overprotect my phone. I had my speck case for about a week before the outershell cracked open. I didn't drop it from a particularly high location or anything and it dropped onto a carpet. So I ordered this one for my phone as it did amazingly for my old phone. So this is more of a review of both the case for the iphone 8 and the iphone 11. For the price and for the durability I am/have always been impressed. I would absolutely recommend it if you dont want a bulky case, but want something that feels sturdy and has a lip to protect both the screen and the camera. Will absolutely continue to be a fan.",5.0,positive
"May 1, 2020",Great and durable case!,Perfect for any phone color. A good durable phone case. Definitely recommend.,5.0,positive
"May 1, 2020",Good quality and very clear,Very sturdy and good quality,5.0,positive
"May 1, 2020",Good case,I wish it had a screen protector. I thought it did when I bought it but it didn’t. Other than that it is a good case.,4.0,positive
"May 1, 2020",Good protection,So far so good! Excellent case for the money.,5.0,positive
"March 1, 2020",Buena elección,Bueno bonito barato,5.0,positive
"March 1, 2020",Nice clear case,Clear and easy to put on my Iphone11. Very nice,5.0,positive
"March 1, 2020",Great quality for price,Great quality for price,5.0,positive
"March 1, 2020",Not as described,Got scratches within 1 hour,1.0,negative
"March 1, 2020",Great case,Great case,5.0,positive
"March 1, 2020","Nice rugged case, some discoloring after use.",This case is real rugged.  Dropped it many times with no damage to my phone.Only issue I have with the case is that the color is starting to yellow from use.  Not as clear as it once was.,4.0,positive
"March 1, 2020",Calidad,Buena calidad,5.0,positive
"March 1, 2020",Good case si far,I like it,4.0,positive
"March 1, 2020",Disappointed,Went to the wrong apartment. No way to report incidents could be out that money 😔,1.0,negative
"March 1, 2020",Clearly perfect,Great for the price,5.0,positive
"March 1, 2020",Fantastic,Great phone case! I bought it for my sister and she loves it!,5.0,positive
"February 29, 2020",Protective but looks messy (fingerprints),"This is a nice case, fits well and the buttons on my iPhone were easily pressed. My only complaint is an aesthetic one...so many fingerprints! The case smudges easily and it’s hard to get the fingerprints to wipe off without some type of cleaner.",3.0,negative
"February 29, 2020",Gets dirty easily,It seems to get dust under it way too easily and really shows fingerprints.  It’s very sturdy but my phone always looks dirty.,1.0,negative
"February 29, 2020",The matte is clear on the back and not matte,The matte is only on the sides.  It shows a matte back but it is not.  Little bait and switch there.,1.0,negative
"February 29, 2020",New case!,"Great case for the price, exceeds expectations.",5.0,positive
"February 29, 2020",Describe the item correctly,Very sturdy and protects the phone well,5.0,positive
"February 29, 2020",Did not disappoint at all,Very good buy for the price,5.0,positive
"February 28, 2020",Finger Print Magnet,"I purchased this case for my IPhone 11. I have always loved Spigen cases. I had one for my Samsung Galaxy 8 and recently bought one for my wife’s IPhone 11 as well. The case is great, well built and sturdy but had to order me another one because this clear case is a finger print magnet. Make the phone look muggy and dirty. No matter how much you clean it after every use it still looks dirty and muggy. Protection is great but if you are a person who hates finger prints and likes to always have your device looking clean this is not the case you want. I am still purchasing another Spigen because to me hands down Spigen makes great durable and sturdy cases that don’t add a lot of bulk to the phone.",3.0,negative
"February 28, 2020",Perfect case,I love the Spigen cases.  I’ve bought one each time I’ve upgraded my iphone.  Not bulky so it fits in my pockets easily and has always been a very good protective case.  This one is a great color and matches my mint green iphone 11.,5.0,positive
"February 28, 2020",Good,I love the quality,5.0,positive
"February 28, 2020",Great,Very good,5.0,positive
"February 28, 2020",Plastico,Se ve increíble pero el plástico protector es difícil de sacar,4.0,positive
"February 28, 2020",Very good,"good price, good function",5.0,positive
"February 28, 2020",Great quality at a great price,"Feels and looks well made, the color fits with my cell phone color.",4.0,positive
"February 28, 2020",You will not sacrifice quality for price with this case.,The color matches the mint green of the iPhone 11 perfectly. It’s also easy to remove and cleans very easily with an alcohol wipe. The lip around the camera and screen protect your photo lenses and screen glass very well.,5.0,positive
"February 28, 2020",Product,New phone durability,5.0,positive
"February 28, 2020",Great,Great,5.0,positive
"February 28, 2020",Spigen hybrid case,Love it so far,5.0,positive
"February 28, 2020",Nice case. And it shows your beautiful iphone,This is a great case to show off your iPhone. It’s clear and yet creates a barrier of protection. And it’s reasonably priced.,5.0,positive
"February 27, 2020",Phone case,This case is not as bulky as most.,5.0,positive
"February 27, 2020",Excellent decision to purchase this case,Perfect fit Great Protection Looks invisible,5.0,positive
"February 27, 2020",It’s good.,I liked that the edges feel slightly higher than the phone itself. Comfortable gri.,5.0,positive
"February 27, 2020",LOVE IT 😍,Best case I could ever get for my iPhone,5.0,positive
"February 27, 2020",Looks like used,It looks like used to many scratches.,1.0,negative
"February 27, 2020",It’s worth the price,It’s ok,5.0,positive
"February 27, 2020",A nice looking case.,Fits very snug. Glad I choose this one,5.0,positive
"February 27, 2020",Does the job,Works as well as expected,5.0,positive
"February 27, 2020",It works perfectly.,"Great product! I bought two, one for my daughter and one for me. We just got our iPhone 11 and we wanted to show the colors on the back of the phone. Initially I was hesitant to buy because I thought they would be flimsy and super soft but the material is hard enough to keep the phone safe. I had previously read some reviews that talked about fingerprints staying on the case, but honestly that’s something you will get whenever you get a transparent case for your phone. It’s almost imposible to keep it from getting fingerprints. I think sometimes people just expect unrealistic things from simple every day objects.Easy to put, buttons function perfect.",5.0,positive
"February 27, 2020",Good quality,Sturdy and good quality,5.0,positive
"February 27, 2020",Great quality,"Great grip, thick lip around screen for protection, crystal clear. Great case.",5.0,positive
"February 27, 2020",iPhone case,Very satisfied,5.0,positive
"February 27, 2020",Great,Great,5.0,positive
"February 27, 2020","Fits really well, also good quality","I’m very happy with this phone case. I hope it hold up. I don’t think I’ll have to worry though. I like the raised corners, it helps the phone to not slide and to not scratch the clear part. I also think it fits the phone so perfectly. I bought a case like this but different brand for my old phone and I had to put a little piece of paper where the power button is because it didn’t line up correctly. This one seems top notch.",5.0,positive
"February 27, 2020",Recommendation for clear case,I am always a clear case fan. It does not add up a lot of thickness or weight and have a good grip to hold. I would recommend if you are looking for clear case.,5.0,positive
"February 27, 2020",iphone 11 case,5/5,5.0,positive
"February 27, 2020",iPhone 11,Clear cover. Fits perfect.,5.0,positive
"February 26, 2020",La calidad y rapidez,Lo que quería,5.0,positive
"February 26, 2020",Good little case,"I thought I would just have this case temporarily since I just purchased the iPhone 11.  Paranoia made me buy it.  But three months later, 7-9 drops from various heights, I am still rocking this case with no qualms whatsoever.  The back is still clear as I didn’t expect.  Wireless charging works.  Magnetic dashboard receptacle works.  Charging port large enough.  Attractive finish still intact.  Definitively 5 stars.",5.0,positive
"February 26, 2020",Bad!,This sucks I had it one day dropped it on my wood floor and it literally broke the clear part fell out like what? Bad case don’t recommend,1.0,negative
"February 26, 2020","Great product, good price!",Nice,5.0,positive
"February 26, 2020","Great case, deceiving color","I really like the case, Great quality and great fit. I ordered two of them, one clear and the other one red, or at least I thought it was red. It looks red in the picture just like it does for all the other colors offered but turns out the phones in the pictures must’ve been colored because only the outside border of the case is colored and the rest is clear.",4.0,positive
"February 26, 2020",Perfect Fit,"fits perfectly onto the iPhone 11 with no issues, even with a screen protector.",5.0,positive
"February 26, 2020",Great purchase!,I read the reviews from many other cases before i bought this one.  I am so glad that I decided on this one.  It is very durable and clear that it DOES NOT take away from the look of my orchid color iphone 11.  I have no complaints.  I really love the recessed edging on the front of the case that protects it from damage should it hit hard surfaces.  There is enough space that the screen won't be impacted with or without a protector.It can be a little slippery but I'm not complaining about that.  I have a shatterproof screen protector on it so all is well.Overall a great product,5.0,positive
"February 26, 2020",Fits like a glove,Perfect fit,5.0,positive
"February 26, 2020",Awesome case that is strong and shows off the beautiful color of my phone!,"I love the color of this phone case because it goes perfectly with my phone color. Also, it has been protecting my phone very well from scratches and falls.",5.0,positive
"February 26, 2020",Incredible deal!,Incredible deal! The product was exactly as described. It arrived on time.,5.0,positive
"February 25, 2020",Great product,Good product,5.0,positive
"February 25, 2020",iPhone 11 case,Perfect case for my iPhone 11,5.0,positive
"February 25, 2020",Very cool with my red iPhone 11,"Overall this case is really good for the price. It’s sturdy enough and not slippery. The clear back has held up for the first 2 months with no yellowing, and complements the iPhone color very well.That being said, the rubber sides have a not so premium feel. I’ll probably be switching to a leather case for my own preference, but this is a great case.",4.0,positive
"February 25, 2020",Worth the money,Nice,5.0,positive
"February 25, 2020",It holds up,I dropped my phone a couple of times and so far there are no scratches,5.0,positive
"February 25, 2020",Solid case,"excellent case, simple and durable.  recommended.",5.0,positive
"February 25, 2020",This was a great buy!,As of writing this review the iPhone 11 case has been perfect I luv it,5.0,positive
"February 25, 2020",It’s great,It’s perfect,5.0,positive
"February 25, 2020",Slim,My teenage son loved it as it not bulky. It is slim.  I don't know much about durability and sturdiness being that slim.  We shall see after using it for a while.,5.0,positive
"February 25, 2020",Good quality,Nice clear case,5.0,positive
"February 25, 2020",Vgood,VGood,5.0,positive
"February 24, 2020",good case,not a bad case,5.0,positive
"February 24, 2020",Slick looking see through cover,Looks great but has some flex on one side where the single on/off button is.,4.0,positive
"February 24, 2020",Good Value,Sturdy and good value,4.0,positive
"February 24, 2020",Ultra Hybrid case- not worth it.,"Returned. The 11 pro didn't fit well, too loose, in this case. The case is too slick and difficult to hold without slipping. There are better Spigen cases.",2.0,negative
"February 24, 2020",Solid overall case,I’ve dropped it several times and haven’t had a crack yet.,5.0,positive
"February 24, 2020",Spigen is top notch,Spigen case is top notch as I expect.  Cases are always quality.,5.0,positive
"February 24, 2020",Thumbs up!,This case was easy to attach and is crystal clear. I like that is has flexibility. Thumbs up!,5.0,positive
"February 24, 2020",Durable,Good case,5.0,positive
"February 24, 2020",Buena calidad,Para proteger,4.0,positive
"February 23, 2020",Excellent product,Excellent product. Worth the price.,5.0,positive
"February 23, 2020",Works,Works,5.0,positive
"February 23, 2020",The one,Great,5.0,positive
"February 23, 2020",Amazing iPhone cases,This has been my choice of cases for a while now and iPhone 11 case is also a champ.,5.0,positive
"February 23, 2020",Excellent Case,Love this case!!! I spent hours researching the best case for my new phone and ended up purchasing this one. I got the green to match my phone and it looks amazing! The raised sides are great to protect the screen as well as cameras. Great quality and easy to put on. It has a good grip to it as well. I’m super happy with my purchase.,5.0,positive
"February 23, 2020",The most ugly branding on all edges of the cover,"Yikes. I did not know that the brand name would be on all edges of the cover. There's a long ass branding ""SPIGEN MADE IN SOUTH KOREA"" on the edges and it's just not aesthetic.",1.0,negative
"February 23, 2020",As always spigen did it great!,It’s very great in design and it’s very robust to protect your iPhone 11,5.0,positive
"February 23, 2020",ship fast and on time,great product,5.0,positive
"February 23, 2020",I like it,I like it,5.0,positive
"February 23, 2020",Best iPhone 11 Case,Fits perfect.Exactly what I wanted in a case,5.0,positive
"February 23, 2020",Very nice product,Got this for my kids and it works wonderful!,5.0,positive
"February 23, 2020",Look different,Phone,4.0,positive
"February 22, 2020",Perfect fit,Works as expected.,5.0,positive
"February 22, 2020",Love,Love this case. Fit the iPhone 11 perfect!,5.0,positive
"February 22, 2020",Berry gud,Protecc phone,5.0,positive
"February 22, 2020",Chick iPhone 11 battery case with wireless built in,Fits iPhone 11 perfect & easy to handle & works great with wireless base,5.0,positive
"February 22, 2020",Misleading,"This is lame as all get out. I thought the product would be fully red not just red on the outside. The pictures make it seem so so if you’re looking for a solid case color, this ain’t it.",1.0,negative
"February 22, 2020",Recommend Spigen! Solid products.,Always like spigen products so I buy over and over again when I get new phones etc.,5.0,positive
"February 22, 2020",IF YOU ARE CLUMSY!!!,I am so clumsy and drop my phone every two seconds so the fact that my phone has not broken is amazing. I have tried other cases but my phones would always be cracked or broken in some way.,5.0,positive
"February 22, 2020",Satisfied with this purchase,I purchased 4 of these (2 green and 2 black) for my families iPhone 11’s along with the Spigen screen protectors. These fit perfectly on our phones. They look great and seem very sturdy. I would recommend these and the screen protectors as well. Both are great.,5.0,positive
"February 22, 2020",Durable and Fits perfectly,Pros:Feels very protective specially on the edges.Transparent backCons:A little thicker than expected.A bit slippery when holding the phone.,4.0,positive
"February 22, 2020",There are better cases,Not as sturdy as it looked online. Definitely didnt protect the phone as much as desired. We upgraded pretty quickly.,2.0,negative
"February 21, 2020",Slippery,Kinda slippery and dont like the random text on the side of the case,4.0,positive
"February 21, 2020",Great Case,Great Case for a great price!,5.0,positive
"April 30, 2020",Very nice light weight protective case,Looks just like the pictures. So far it’s working as advertised.,4.0,positive
"April 30, 2020",It’s not the full color all over.,"First of all, I felt deceived by this. It is actually clear with only the edges being black. I also ordered it in red thinking I was getting an ALL red case. Again, it was clear with only the edging in red. My son didn’t seem to mind it.",1.0,negative
"April 30, 2020",Case is clear not black.,The photos make it appear the case is black when in fact it is clear. Not what I wanted at all. I will use until I find another brand.,2.0,negative
"April 30, 2020",Durable just be mindful to take care of it. Shouldn’t have any issues,It’s great,5.0,positive
"April 30, 2020",Fits well and easy to install!,Fits the phone really well and seems to be of good quality!,5.0,positive
"April 29, 2020",Best Case,Perfect! Exactly what you need if you want a thin safe phone case!,5.0,positive
"April 29, 2020",Is very nice,👍👏🏼,5.0,positive
"April 29, 2020",Clear,It’s easy and basic,4.0,positive
"April 29, 2020",Fingerprint City: NOT matte finish,"Generally, I like Spigen's cases and have owned many of them over the years starting with my iPhone 4. (Wow, that long ago?) Their cases always fit well, last and look good, so I ordered this one from the description on Amazon and my own experiences with previous Spigen cases. This one, however, was a big disappointment because after it came it quite obviously did NOT have a matte finish on the back. Maybe the sides or something, I don't know what they're referring to, but the back section part of the case left all kinds of finger prints from my grubby little hands. That's a deal breaker for me, so back it goes.",3.0,negative
"April 29, 2020",Great case,Got this before the ETA.  Fits the iPhone 11 as it should.  Easy to hold and seems like a sturdy case.  Great value!,5.0,positive
"February 21, 2020",Love it,I love it ... much better quality than I expected.Highly recommended,5.0,positive
"February 21, 2020",Sturdy and good quality and helps you to have a good grip with your phone,"This is a clear phone case suited for IPhone11 since it’s a clear case and you can clearly see your phone through it, it might seemed at first that it is as if there isn’t any protection from this case but in contrast to that I am surprisingly very impressed with it’s quality because it is sturdy, durable, and very easy to hold and material makes you help to have a good grip with your phone to avoid having accidents like slipping from your hand/ fingers. So for those who like to see their iphone11 and show it’s actual size and apprearance this case is a very good protector.",5.0,positive
"February 21, 2020",I loved it,"If you want to showcase the beauty if your phone, this is the right case for you",5.0,positive
"February 21, 2020",Doesn’t yellow,"It’s a little slippery but I don’t mind that because I put a popsocket on it. Hasn’t yellowed at all like some clear cases do and I’ve had it for about 2 months. My sister got one from somewhere else that yellowed within 2 weeks. So I don’t think this one will go yellow, that alone gets it 5 stars from me.",5.0,positive
"February 21, 2020",Perfect Case,"When I got my new phone, I caved and bought the clear Apple case at the store because I was too scared to leave my phone unprotected, even for a few days. However, I quickly started hating the case. When it was first put on in the store, it was perfectly flush against the phone. It was INCREDIBLY hard to take off, and I wanted to clean it often because it was easy to notice when it was dirty, but the more you took it off, the worse it fit your phone. It would get looser and looser. So after two months, I decided to get a new case. There are lots of highly rated clear cases on Amazon, but I found that some of them would trade gift cards for five star reviews. I’ve used Spigen before and knew I could trust the brand, and I ultimately settled on this one, and I’m so happy I did.I really like the bumpers on the corners of the phone. They’re not very noticeable of bulky. I also love the raised edge around the camera and the screen. I have a screen protector, but I like the extra security. This case is the perfect compromise between slim and protective.My only complaint is that there is text on three of the four sides. I really prefer a minimalist look, and I don’t mind having a little logo or brand name on one edge, but three seems excessive. However, once the case is on, its not as noticeable as you think.I would highly recommend this case to anyone who wants to show off their phone, but doesn’t want to compromise protection.",5.0,positive
"February 21, 2020",Good Protection,"box was bent on arrival, bought for my husband. he likes it. He says it feels like it will protect his phone. so that good",5.0,positive
"February 21, 2020",Spigen crystal clear color.,Fine protections for my Iphone 11 in crystal clean color!,5.0,positive
"February 21, 2020",Happy customer,Highly recommend and a great customer service,5.0,positive
"February 21, 2020",Sturdy case but changed color within one month.,"I've been experimenting with a variety of clear iPhone cases.  This has been one of the sturdiest and most protective.  However, all four sides have turned blue in less than one month from keeping my phone in my denim jean pants pockets.  These aren't new, unwashed jeans.  They are aged enough that I haven't experienced discoloration with any other cases.  Also, I find dirt, dog hair, and water gets caught between the case and my phone.  Lastly, three of the four sides have writing on the case.  One side has the brand name (understandable), but another side reads 'Spigen Inc. in Irvine California Made in South Korea' followed by a numerical sequence, and the other reads 'AR Cushion Technology' with an arrow.",3.0,negative
"February 21, 2020",Forever a 5 star case!,"Love this case! The case it’s self is clear and the outer trim is black, I love the look of it. I absolutely adore this case because I’m very clumsy and can say that it’s definitely held up its end of the deal.",5.0,positive
"February 21, 2020",Not Bad,Good for protection but the frame started to yellow after one month of use !!,3.0,negative
"February 21, 2020",Excelente calidad 👍🏻,Excelente,5.0,positive
"February 20, 2020","Lip coverage, sturdy",Great case fore the price. Would recommend,5.0,positive
