"January 4, 2020",Came very fast,My grandson just loved it!!!!,5.0,positive
"January 4, 2020",Our daughter loved it,Exactly as discribed👍🏼,5.0,positive
"January 4, 2020",The whole family finds things to play,Kids love it,5.0,positive
"January 4, 2020",Christmas 2019,"Kids loved it, easy to set up.",5.0,positive
"January 4, 2020",The switch is pretty great,Pretty good. I knew what i was getting when i purchased it and i really enjoy the switch. The fact it can be both a normal console and a portable one is amazing and it has some great games,5.0,positive
"January 4, 2020",Enjoyable device.,It is so much fun! We can all play as a family and my son loves it. I really like that it has the parental control app for our phones and the notifications it sends are very helpful.,5.0,positive
"January 4, 2020",Nice,can put it down.  really awesome switch and battery last longer than the other one.,5.0,positive
"January 4, 2020",Great switch!!!,Love it....,5.0,positive
"January 4, 2020",Much appreciated Grand Parent,Came just as planned for Grandson for Christmas... He just loves it much. Thank You,5.0,positive
"January 4, 2020",Grandkids loved it,Bought 2 for Christmas. My grandkids loved them and play with them all the time.,5.0,positive
"January 4, 2020",Battery is much more reliable,Product is original and of consistent quality. Happy with my purchase,5.0,positive
"January 4, 2020","Mostly as described, $30 holiday listing was phony","Factory, but the $30 reward/rebate was obviously a scamazon issue. Shoulda bought it at target, a retailer at least will qualify the $30 rebate. And acknowledge it actually existed.  Class action anyone?",4.0,positive
"January 4, 2020",So happy with this purchase!!!,This IS the new one. Fantastic console. And I’m obsessed with Breath of the Wild right now.,5.0,positive
"January 4, 2020",Great experience,"All good, honestly I have no regrets with this purchase, it's really good to play in all modes, and multiplayer games are awesome and really fun.",5.0,positive
"January 3, 2020",Our grandson loves it!,"Christmas present for our grandson, he loves it !!!",5.0,positive
"January 3, 2020",Excelente,Súper bien,5.0,positive
"January 3, 2020",Great but imperfect,"Great system, I love it.Only complaint is the joycons are a little on the fragile side",4.0,positive
"January 3, 2020",It has way better battery life!,"I really liked the new and better battery life on this switch and it was much cooler at around 75 degrees Fahrenheit, thanks!😁",5.0,positive
"January 3, 2020",Kids love the Switch,"Girls wanted this for a while. They had saved their money, but we surprised them with it for Christmas. They love it!",5.0,positive
"January 3, 2020",NINTENDO Switch,Perfect,5.0,positive
"January 3, 2020",Gaming system,My son loves it,5.0,positive
"January 3, 2020",Portable,This is great! My boyfriend has been wanting one for a while so I bought him this for Christmas. It’s perfect to take around the house and not be stuck in one room!,5.0,positive
"January 3, 2020",Great,Nice,5.0,positive
"January 3, 2020",As described!,Brand New!,5.0,positive
"January 3, 2020",Great gift,"Got this as a Christmas gift for my thee children (ages 6,8, and 11).  They all love it.",5.0,positive
"January 3, 2020",Great product! Highly recommended!,Bought this for Christmas present for my adult children. Fantastic fun for the whole family. There are so many entertaining games. Highly recommend!,5.0,positive
"January 3, 2020",Christmas,Perfect gift,5.0,positive
"January 3, 2020",Great system!,"I grew up playing Super NES, Nintendo 64, and Gameboy. The Switch is essentially all three of those systems wrapped into one. While traveling, I use the Switch exclusively in handheld mode. However, when I'm at home, this system gives me the option of playing on the TV as well.It comes with everything you need to start playing (except for a game). I've got a couple of games for it and also downloaded free games. I haven't purchased a SD card and haven't had any issues with space. I haven't upgraded the joy cons or purchased a pro controller. My wife and I play Mario on this a few times a week with the joy cons and they work just fine. Obviously, upgrading to better controllers would be more comfortable but it isn't impossible to play without the pro controller.The games are expensive but that is the case for new PS4 or Xbox games as well. Take advantage of the free games that you can download through the Nintendo Store (there are videos reviewing them on YouTube all of the time). I've been able to find cheaper games at GameStop. The longer the Switch is out, the easier it will be to find used games.There are some limitations to the online playability with the Switch. My understanding is that you'll need to join Nintendo Switch Online ($20 a year) in order to play most games online. However, I didn't buy it to play online (assuming that I'd be playing it when I'm in an airplane, road trips, etc.) so I can't really speak in much detail to these limitations.",5.0,positive
"January 3, 2020",Entire Nintendo Package Included,"Recently bought this for a Christmas gift in 12/19. This is the total package, quite expensive, but the total package! It's probably best to buy as a package and not separately The package contained the below:- switch console- red & blue joy-cons- 2 attachments for the joy-cons with wrist attachments- HDMI cord- platform attachment for using the switch on the tv- wall charger cord",5.0,positive
"January 3, 2020",Nintendo Switch Console,This was a Christmas gift for our son. He loved it. He has played  for hours. The console is just the right size. The screen color and clarity is remarkable. It is very comfortable in your hands.,5.0,positive
"January 3, 2020",Nintendo Switch,Perfecto!!,5.0,positive
"January 3, 2020",For all ages,Wonderful gaming system for all ages. I bought it for my 5 year old son for Christmas  and by the end of day everyone was playing form 5-70.,5.0,positive
"January 3, 2020",Great,Great,5.0,positive
"January 3, 2020",Great gift,It was exactly what they kidd wanted.,5.0,positive
"January 2, 2020",Love our Switch,Thank you so much for getting my son’s Switch in the mail to me so quickly.  He loves it!,5.0,positive
"January 2, 2020",Switch,"Son loves the game counsel. My son can do many things. Watch YouTube, Netflix, Hulu, and, of course, play games. Great for the price.",5.0,positive
"January 2, 2020",very good,Very good,5.0,positive
"January 2, 2020",Great gift for teens!,Gift for my kiddos. She loves it,5.0,positive
"January 2, 2020",Nintendo Switch,Ordered this for my grandsons in Kansas. They love to play the switch!!,5.0,positive
"January 2, 2020",Kids love it,Worked perfect,5.0,positive
"January 2, 2020",Nintendo the best,"Thank you nintendo, we bên having so much fun",5.0,positive
"January 2, 2020",For a Video Game fun!,Great delivery and no damage on arrival-some reviews made me nervous about that. As a PS4 loyal I an pleased to say I LOVE the Switch. Tons of fun and a different take on console. Graphics look great!,5.0,positive
"January 2, 2020",Nothing,Perfect,5.0,positive
"January 2, 2020",Not for mr,Very hard to play,1.0,negative
"January 2, 2020",As Expected,Great product. Arrived quickly and in great shape.,5.0,positive
"April 23, 2020",OVERPRICED,Horrible Price Gouging,1.0,negative
"April 23, 2020",9 Year Loved This !,"Being a birthday present for my 9 year old, i was Super happy with the quickness to receive. As well i love that this has parental guidelines, he only has a set amount of playtime each day and it shuts off a certain time.",5.0,positive
"April 23, 2020",Unfair,Ridiculously Overpriced,1.0,negative
"April 23, 2020",DO NOT BUY!!!,THE PRICE SHOULD BE 299.99 plus taxs DO NOT BUY IF ITS MORE !!,1.0,negative
"April 23, 2020",What a scam!,What a scam!,1.0,negative
"April 23, 2020",Third party pricing of the system is bad,I don’t feel the device is worth 500 dollars that is being sold by third party sellers. I got a Switch from a local store before this pandemic hit and I only paid 299.99 plus tax and plus warranty. The Switch is great but it isn’t worth higher than what Nintendo priced it at.,1.0,negative
"April 23, 2020",Essential for 2020,"Originally bought this for my brother but as the pandemic hit, I am “stuck” with it until I get to see him. I have never used any portable console before but I love this one, it seems too fragile though so I’m looking into see if there are any cases for it. Won’t regret buying it, specially during these times!",5.0,positive
"April 23, 2020",STOP BUYING THESE UNTIL THE PRICES GO DOWN,"if you buy one of these consoles for $500+ you are part of the problem. People are buying these with bots and shooting the price up. It's not worth paying double it's value just to play Animal Crossing, wait until the prices go back to retail and let the scalpers starve on their stockpiles",1.0,negative
"April 23, 2020",Good buy... but games are expensive.,Came as described and really fun! No problem with packaging or late shipment.,5.0,positive
"April 23, 2020","Do not Overpay, just be patient.","If you watch the Amazon page, it comes into stock multiple times a day, but only for 3 mins or so before selling out. Refresh your browser until you catch one in the cart and check out asap. I nabbed it on the 4th try and it took 3 days.Happy Hunting! Its so fun!",5.0,positive
"January 2, 2020",Great gift,Bought for xmas for grand sons. They loved it. Great price,5.0,positive
"January 2, 2020",Great,Grandson loves it,5.0,positive
"January 2, 2020",The best portable gaming device of the 2010s,"I bought this for my younger sister as a Christmas present, along with Zelda BoTW and a SanDisk drive. She loves it!! I love how intuitive it is to learn the controls, she had the hang of it in no time, and being able to play looking at the switch screen OR play looking at a monitor/TV is soo nice. The battery life is great too, it charges perfectly fine with a portable charger, or wall charger. Cannot wait to see what Nintendo brings us in the 2020s.",5.0,positive
"January 2, 2020",Great Present,My teenage daughter loves this Switch,5.0,positive
"January 2, 2020",Best game console for family with little kids,My son is in lower grade of elementary school. Nintendo switch is the best game console for us because many games for kids are exclusive on Nintendo. The console can be used for TV projection or hand hold so it is good for both home and travel. The battery life is good too.,5.0,positive
"January 2, 2020",Came fast and worked good.,Came fast and worked. lots of fun.,5.0,positive
"January 2, 2020",Worth the money,"I've been wanting a Nintendo switch for so long and I finally had the courage to buy it. Worth the money, the console runs smoothly, easy to setup.",5.0,positive
"January 2, 2020",Fun for myself and my family,Love my Switch. Saved me from some pretty awful things.,5.0,positive
"January 2, 2020",Fast shipping just as promised,Daughter loved it,5.0,positive
"January 2, 2020",Great product. Thank you!!!,Great product. Thank you!!!,5.0,positive
"January 2, 2020",Good,Good,5.0,positive
"January 2, 2020",Great buy,Gift for my son and he loved it!,5.0,positive
"January 2, 2020",Good buy,Received on time. The kids love it.,5.0,positive
"January 2, 2020",Joy con stuck or malfunctioned,Kids opened this and everything looked fine until they put in a racing game and the vehicles just move to the right without hitting any buttons. To go straight you have to constantly hold to the left 🤦🏼‍♀️ Very annoying and not worth $300,2.0,negative
"January 2, 2020",Fantastic,My granddaughter age10 said it was the best present ever! That’s good enough for me!,5.0,positive
"January 1, 2020",It's great,My son loves it,5.0,positive
"January 1, 2020",Great gift for ten yr old boy,Perfect Christmas present for our 10 year old. Love the coordinating parent app to control settings with. Ten yr old is obsessed with this thing (previous PS4 user). Would totally recommend!,5.0,positive
"January 1, 2020",Love my switch,"I absolutely love the switch. It has lots or great exclusives like mario oddessy and Luigi 's mansion. I definitely needed the extra battery since I'm constantly playing on handheld mode. The switch does lack bluetooth,microphone and customization  features such as wallpapers. There are ways around this but it definitely would have made the console better.",5.0,positive
"January 1, 2020",Switch from Santa,Kids thoroughly enjoyed their Christmas present from “Santa”. So far so good with playing. Extremely easy to set up and begin playing.,5.0,positive
"January 1, 2020",Nintendo switch,I like my Nintendo switch,5.0,positive
"January 1, 2020",Too Many Accts to Create,"Just setup our Switch and I couldnt be more disappointed. It will make you create a Nintendo Acct. Then a user profile. If you want to play Fortnite, youve got to create another acct. Want to play original NES games? first youve got to create another acct. The family acct for Switch Online is $36/yr (watch the auto-renewal!) and there are very few games to choose from. I'm sure by the time they actually add the games I'd enjoy, they will discontinue the network like they did with the last Nintendo online network. Wish the corporate executives would just let people pay once for a game, then play the game without making you create 10 passwords you will never remember and pay for ""services"" that you'll never enjoy. What a total ripoff. Nintendo, I wish you ill.",2.0,negative
"January 1, 2020",Fun gaming system,"Fun, my kids love it. Nice they can play in the console or hook up to the tv.",5.0,positive
"January 1, 2020",Family Fun,Great for family fun.,5.0,positive
"January 1, 2020",Lovely portable console,Nintendo switch is a lovely little console for anyone to enjoy either in the dock or while out or traveling. This is the newer version of the switch with a longer battery life which is nice,5.0,positive
"January 1, 2020",5 stars,Fast delivery and very good product!,5.0,positive
"January 1, 2020",Works great,Son loves his switch,4.0,positive
"January 1, 2020",Fast and easy purchase,Got here on time as advertised.,5.0,positive
"January 1, 2020",Great system,Fun,5.0,positive
"January 1, 2020",He’s addicted,Got it for my boyfriend for Christmas and he has not stopped playing it since!,5.0,positive
"January 1, 2020",Look mom I have a Nintendo Switch,Awesome!,5.0,positive
"January 1, 2020",Nintendo has done it again,"Gift for my granddaughter ,she loves it was easy to connect to home wifi",5.0,positive
"December 31, 2019",Don’t recommend compared to the Xbox,"Very disappointing compared to the Xbox! The monthly subscription only gives you access to the old fashion 80s games, all the other games you have to purchase. My daughter has an Xbox as well and we have the monthly subscription that comes with a load of wonderful games!",2.0,negative
"December 31, 2019",100%,"It came as expected, it worked great with no issues, even linked my Nintendo account and everything. Solid system.",5.0,positive
"December 31, 2019",Great console,The only thing I don’t like is the small buttons and their close proximity to each other. My thumb can cover all four face buttons at the same time. But they work fine for my nine year old.,5.0,positive
"December 31, 2019",Fun for Family racing night,My 2 boys love this.It brings the family together for Mario Kart racing night,5.0,positive
"December 31, 2019",Excelente,"En perfecto estado, nuevo y envió super rapido.",5.0,positive
"December 31, 2019",Quality service,Son loves it,5.0,positive
"December 31, 2019",Great gaming system with awesome graphics,My 10 year old son LOVES this gamer! He also really loves that he can still play with his friends on Fortnite no matter what system they are playing from. Great little system.,5.0,positive
"December 31, 2019",Joycon Drift is pretty bad,Really bad joycon drift,3.0,negative
"December 31, 2019",well worth it,6-year old grandson loves it,5.0,positive
"December 31, 2019",Fun Gaming,Works great as advertised.,5.0,positive
"December 31, 2019",Great gift,I bought this as a gift for the gamer in the family.  He is very happy with the Nintendo Switch and the game I bought separately.  It was delivered earlier than expected.,5.0,positive
"December 31, 2019",Great product/no problems,My son absolutely loves his switch!!,5.0,positive
"December 31, 2019",Easy and fun.,Love it. So simple to use and it shows you step by step how to set up so us old people can do.it very easily.,5.0,positive
"December 31, 2019",Exactly what we wanted,Great gaming! Works perfect-we have really enjoyed playing.  We’ve had no issues with the console.,5.0,positive
"December 31, 2019",Funciona a la perfección,Exactamente como lo describe,5.0,positive
"December 31, 2019",Well received,As advertised & perfect Christmas gift.,5.0,positive
"December 31, 2019",Was exactly what I was looking for,Was perfect gifts for my boys,5.0,positive
"December 31, 2019",Great gift,"This was my sons big item for Christmas, he was so excited!!!",5.0,positive
"December 31, 2019",Just what I wanted,Loved it !! Worked great and everyone is happy,5.0,positive
"December 31, 2019",Tons of family fun,Kids love it,5.0,positive
"December 31, 2019",Pretty Straightforward,"It was pretty much what I expected, don't really use the handheld function as much but all around a solid product.",5.0,positive
"December 31, 2019",Total mentira,"El producto muy bien , pero en el momento de la compra venía una oferta de $30 dólares de regalo , era sólo una propaganda para llamar la atención al comprador , porque no sé respeto la oferta , era una gran mentira",4.0,positive
"December 31, 2019",Fun and mobile,Great system for casual gamers. Awesome for being on the go and lots of perks included with the switch online subscription.,5.0,positive
"December 31, 2019",Switch,My great grandson was ecstatic with it. He had wanted one for a long time.,5.0,positive
"December 31, 2019",His new best friend,"Bought this for my fiance so he has something to do while I make my quilts, He loves it and so do I",5.0,positive
"December 31, 2019",Daughter loves it,My daughter Ioves the games and the product .,5.0,positive
"December 30, 2019",terribly expensive games ruin it,"the physical device is really nice. The excessively expensive games are not. Why are 2+ year old games still selling for 60 bucks?? Besides that, Amazon's promo during the holidays for a 25 dollar credit is extremely limiting in what it actually applies to. I feel deceived by the lack of transparency, Amazon!",2.0,negative
"December 30, 2019",Switch was perfect,I love the item for my son can you tell me how to get insurance for it,5.0,positive
"December 30, 2019",Good value,Price was reasonable. Christmas gift.,5.0,positive
"December 30, 2019",Easy to use and set up,Great product kids like it a lot,5.0,positive
"December 30, 2019",Love it!,"Basically bought it just for Zelda BOTW, but am enjoying it with the family! We have 3 now!",5.0,positive
"December 30, 2019",Charger stopped working...,"After we received the Nintendo Switch, within days the charger for the console stopped working.  Not impressed at all.",1.0,negative
"December 30, 2019",Love it,Awesome game,5.0,positive
"December 30, 2019",Great Xmas gift,Like the new improved battery length.,5.0,positive
"December 30, 2019",Its great,This is a great console to pick up for people who cant put their games down. May very well be the best console nintendo has ever made,4.0,positive
"December 30, 2019",Awesome!,"This was a gift for my son he absolutely loved it. Would definitely recommend it to someone, great value for the money!",5.0,positive
"December 30, 2019",My Son Loves it,"It is great.. The old one wasn't working right, but this is great",5.0,positive
"December 30, 2019",Grand Kid loves it,Delivered on time everything worked and the Grand Kid loved it,5.0,positive
"December 30, 2019",Worth picking up!,"If you enjoyed your Wii or 3DS, this is a “no-brained”.",5.0,positive
"December 30, 2019",That it's a good product.,For my son to play with his little friend.,5.0,positive
"December 30, 2019","Muy bueno, es la última versión.","Muy bueno, es la última versión, con el procesador mejorado para un mayor rendimiento de batería.",5.0,positive
"December 30, 2019",Good buy,No problems,5.0,positive
"December 30, 2019",The price,It was a great deal,5.0,positive
"December 30, 2019",Product Good--Promise was not,"My daughter loves the switch. However, upon purchase we were told we'd get a $30 gift card for games and that never happened. I've been checking my email daily...and nothing has come through.",3.0,negative
"December 30, 2019",Don't think monotone will save you.,I ordered the version with two gray Joy-Cons so the children could't argue over which color controller. They argue over which controller layout instead. But the console is a hoot. Five stars.,5.0,positive
"December 30, 2019",Good luck if you get a defective dock,"Dock fails to connect to the TV right out of the box. Contacted Nintendo and they required we send the entire system in, which would take up to 4-weeks, to repair. Customer service person was polite.$300 for a defective component. We will never purchase a Nintendo console again.",1.0,negative
"December 30, 2019",Awesome Nintendo system,Great game system had no problems with it,5.0,positive
"December 30, 2019",Packaging arrived wet and damaged,"I received the Nintendo switch today, however, the box arrived soaking wet in the packaging beat up. Concerned the product won’t work.",1.0,negative
"December 30, 2019",Nintendo switch didn’t work; neither does Amazon.,"My son opened his Nintendo Switch on Xmas day. Five days later it didn’t work. It won’t charge after all trouble shooting efforts. Nintendo wants me to send it in for repairs, leaving my son with no switch for an undetermined amount of time. Amazon will send a replacement February 2nd. Which is more than a month.I am wondering when did it ever become acceptable to pay for a toy (that cost more than my car payment) only to have it not work, or wait not days, weeks, but more than a month later.This sucks on all levels. Amazon & Nintendo gets Rotten tomatoes from me!",1.0,negative
"December 30, 2019",Muy mal servicio,"compre la switch por Amazon.com Services LLC y al momento de conectar al televisor no funciona y al reclamar la garantia me indican que no pueden hacer nada. Tenia fe de que al comprar por aca tendria mejor soporte y aseguraba una compra de calidad pero no, viendo que ahora me toca quedarme con un nintendo defectuoso hubiera preferido pagar casi el doble en alguna tienda de electrodomesticos donde si aplicaria la garantia sin ningun problema. Lastima que siendo una pagina tan buena para compras no ayuden con la garantia ni te den soluciones al equipo defectuoso.",1.0,negative
"December 30, 2019",Great!,My son loves it!,5.0,positive
"December 30, 2019",Good product,"My granddaughter is so excited to have her Switch. I have never bought a game system that doesn't come with a starter game. That was a great disappointment. Luckily, she likes the cheaper games, so we went out and bought Tetris and Minecraft so she would at least have a few games to start.",4.0,positive
"December 30, 2019",Very satisfied,Arrived on time and has proved to be a great gift for my son!,5.0,positive
"December 30, 2019",Family fun,"My 8 year old son loves this system. He’s never really been into video games, but it’s easier for him than the PS4 and other newer systems. It’s nice that he can play on the tv or just hold it in his hands. We’ve only owned it for a week, but so far it’s great.",5.0,positive
"December 30, 2019",Great console,Loving my time with it.,5.0,positive
"December 30, 2019",Great value for the money,My 11 yr old great-granddaughter absolutely loves her Switch.,5.0,positive
"December 29, 2019","Poor quality, but not a rip-off or anything","We've only had them for a week, but one of the joy-cons is already malfunctioning. The right one - the joystick/cam will sometimes spin freely of its own accord. Annoying.",2.0,negative
"December 29, 2019",Disappointed,"The switch and accessories are cheaply made. My first issue with the the system was the controls.... The controllers are insanely expensive and luckily my wife bought me a extra set of controls for my Christmas present when she bought the switch because within a couple months two of the 4 controllers stopped working. Looked it up and apparently alot of people were having this issue. But was deploying and really wasnt to worried about it. So got back from my deployment and tried to play  my switch on the dock and guess what that decided it wasn't going to work either, looked this up... Guess what alot of people had that same issue too. If I want to replace the dock and one set of controllers it would cost over half the price of the system. Every other system has expensive accessories but I can depend on them to work. But I do love the switch but hate the fact I can't use it on the TV to actually play games with my family which is half of the reason people buy this system... Other wise I would rather stick with my PlayStation for anything at home and only play my switch if I'm out of the house and have nothing to do.",1.0,negative
"December 29, 2019",Great product,I got this for my son it works great he loves it. Everything is working fine. We hooked it up to tv it’s working perfect. The only problem is he wants more games and they are not cheap lol be prepared to buy games.,5.0,positive
"December 29, 2019",The best switch yet!!,"Basically the same with the V1 switch. However, I think that the extra battery is worth the upgrade. Now I can enjoy a game-like breath of the wild for a long period of time on the go without worrying to recharge it again.",5.0,positive
