"January 9, 2020",Favorite purchase ever!,"By far my and my family's favorite gaming system ever! Believe me we've had so many gaming consoles over the years. My 8 year old girl will not put this down! She loves Zelda! We plah Just Dance frequently and it has excellent intelligence to what you are doing. It really gets you moving if you are willing! You can play classic with it hooked up in a dock and connected to the TV (console is very small which is great), or you can put the joy cons on the console and play, of you can play with it looking like a old Nintendo 64 controller or x box/playstation controller. It's also touch screen!",5.0,positive
"January 9, 2020",Good,Excellent,5.0,positive
"January 9, 2020",Good,Good game station,5.0,positive
"January 9, 2020",Awesome,Works great,5.0,positive
"January 9, 2020",So fun!,So much fun. Kids and I have loved it!!!,5.0,positive
"January 9, 2020",Great product,The Nintendo Switch is a great game system. The screen is nice and large making gameplay so much more enjoyable. My son's favorite feature of the Switch is the fact that it can be hooked up to the TV AND he can bring it with him on car rides. I definitely recommend this product! Love Nintendo!,5.0,positive
"January 9, 2020",After 1 Month I'm beyond Happy,"Haven't own a Nintendo console since the Wii. I really wanted something I could play bowling, tennis, Mario etc and after finally pulling the trigger I can say 100% I'm in love with the Switch. My wife and I play every single night and it's great to bring on trips. I wish it was easier to travel with and you didn't need the dock and could just use a USB-C to HDMI but other than that even if you're a casual gamer this is a must have.",5.0,positive
"January 9, 2020",Quolity issues,"This was a gift for our son ""from Santa"" and he was sooo thrilled. Until 5 days later right joy-con died (neon red). The console does not see it as attached and none of the buttons on the joy-con are responding. We tried all the on-line help steps available to no avail. Will try to send it to Nintendo for repair, but I am absolutely unhappy about this. And you can imagine how my 7 year old son feels...",1.0,negative
"January 9, 2020",Love!,I haven’t tried hooking it up to a TV yet but I’m loving my Switch! 💕💕,5.0,positive
"January 9, 2020",Love love love,I love the switch! It’s kinda expensive but so worth it!!,5.0,positive
"January 9, 2020",Keeping up.,"My son purchase with his work salary from the black friday special. He bring it to all the get together events to play against friends. Its a portable and console. It just keeping up and will end up collecting dust like the ds, ds lite, 3ds, wii, and wii u.",5.0,positive
"January 9, 2020",great gameing,I gave one to my 9 my year old grandson he had no problem with it from the start,5.0,positive
"January 9, 2020",Nintendo switch,It's great,5.0,positive
"January 8, 2020",Just as expected!,Perfect!!! My son was so happy he got one...,5.0,positive
"January 8, 2020",Kids love it,Kids love it,5.0,positive
"January 8, 2020",You know if you want it,It's a Nintendo switch,5.0,positive
"January 8, 2020",4 daughter,👍,5.0,positive
"January 8, 2020",Fun!,Nice but for many of the games you need to get the switch online subscription. Regardless of the high prices of the games.,5.0,positive
"January 8, 2020",Merry Christmas,Christmas gift for grandson. He has played it ever day since Christmas.,5.0,positive
"January 8, 2020",No llego,No llego,1.0,negative
"January 8, 2020",Bueno,Kids love it,5.0,positive
"January 8, 2020",Disappointing for me.,"On paper this is such a slick device, and combined with great Nintendo titles this was something I was excited for. BUT this system just isn't there yet. Right now I'm dealing with input lag that goes beyond controller or title specific issues. Right from the get go, setting it up (while in portable mode) felt odd. The touch screen and the attached joy-cons felt a bit slow. The input lag was the same speed as my PS4 with my TVs game mode OFF. Not a huge deal for many who will play most casual games, but annoying enough for me that titles like Cuphead and Enter the Gungeon are hindered. I do wonder if the newer portable only version doesn't have these issues, but I'm mainly interested in this as a home console.And it's online component? They still haven't caught up with Xbox Live from the 360 generation. Not a huge problem with Discord around, but still.Lot's of pluses for this system for sure, but this is mainly a message to people to try out the system first and decide for yourself if the input lag is bad enough to ruin your experience. A lot of people are very satisfied and don't even notice. I can see this not being a problem in games like Pokemon, or Mario + Rabbids Kingdom Battle. I've been playing ""The Touryst"", charming, relaxing, and a nice change of pace from what I usually play.",3.0,negative
"January 8, 2020",Works great,My son loves it,5.0,positive
"January 8, 2020","Bit of a rocky start but good for now!  Wish it was as sturdy as my old PS2,  now that is a beast...","I bought this system for myself as a birthday present, and I have enjoyed using it!  The controllers took a bit getting used to detaching on and off properly.  I think the main thing is to be careful about what games you buy if the device will be worth it to you in the end, or if you are excited about upcoming games.  I waited to purchase the Switch until I knew there were about ten games I wanted to play and added about three of them into the in initial cost as well.  I’m pretty picky about my games because I am a casual gamer. Zelda breath of the wild—which I borrowed from my brother later— is more intensive than anything I have played in YEARS.Games are expensive in physical format, although that is my preference.  There are some cheaper games on the online store.  So far my favorite local game shop does not have any used copies of Switch games although they have everything else.  Maybe some day.I might buy a screen protector for it in the future but have not as of yet.  If your Switch is to see heavy use by an entire family or if as an owner you plan to travel with it I’d recommend one but that is not the case for me. I did have a problem within a month of ordering the machine where the fan started whirring LOUDLY.  At first only when it was plugged in to charge then all the time when it was at rest, then at last even while playing a game.  I called Nintendo customer service and had it repaired (although I had to send it back three times with the same issue to a radioshack in Syracuse NY.  Last time I sent it in they just replaced the system.)If I have a problem in the future I will request replacement rather than repair, especially if it’s going back to New York.  Just not happening.  At least customer service was good, but I was becoming a bit disgruntled toward the end there with their techs!  For my troubles customer service gave me a new set of controllers automatically and then later, three months free on the eshop.  Oh, and the second and third shipments were two day free.",4.0,positive
"January 8, 2020",Very good!,Just what you would expect! Haven't had any issues and hope it continues that way!,5.0,positive
"January 8, 2020",Lots of fun,"I purchased this as a gift, and the recipient loved it.  This is the one with the longer battery life.",5.0,positive
"January 8, 2020",Wonderful gift,It was perfect.,5.0,positive
"January 8, 2020",Awesome,No complaints at all,5.0,positive
"January 8, 2020",Love it,My grandson loves it he told best Christmas gift ever.,4.0,positive
"January 8, 2020",Little pricey,Does what its supposed to do,5.0,positive
"January 8, 2020",Fun!,Great,5.0,positive
"January 7, 2020",Rapidez y calidad,Excelente producto y entrega muy rápida,5.0,positive
"January 7, 2020",great product,"Portable, very fun and easy to use, recommended!",5.0,positive
"January 7, 2020",Great game set,My kid loves the Nintendo Switch. Easy to work. Received quickly and packaged well.,5.0,positive
"January 7, 2020",No ac adaptor,Actually really upset. I was so excited to come home and hook this up. However there was no AC Adaptor in my box. There is also no way to contact the seller. Debating on returning,1.0,negative
"January 7, 2020",Defective item that had already been opened.,Item was already opened with fingerprints all over the screen.  This item did not turn on at all nor would it charge.  I returned the item.,1.0,negative
"January 7, 2020",Got exactly what I asked for,Just what I purchased,5.0,positive
"January 7, 2020",Son loves it,My 16 yr old son! He loves it!,5.0,positive
"January 7, 2020",Xmas toy,It works as it should,5.0,positive
"January 7, 2020",Excellent present,Works perfectly fine. My son love it,5.0,positive
"January 7, 2020",Exactly what we expected.,Nintendo games,5.0,positive
"January 7, 2020",It was good,It was what I expected!!,5.0,positive
"January 7, 2020",Great for a 3 and 7 year old,Got this for my 7 and 3 1/2 year old for Christmas and they both love it!!,5.0,positive
"January 7, 2020",Excelent,The product is very good,5.0,positive
"January 7, 2020",Nintendo Switch,"Buena compra, queda totalmente recomendado.",5.0,positive
"January 7, 2020",Works good,Works good,5.0,positive
"January 7, 2020",The best,Love it! Came quick. Works perfectly.,5.0,positive
"January 7, 2020",Great for the family,My son received this as a gift. He says it works great the only thing that takes some time is when you have to download games. Easy to hold and great picture quality.  Also nice to be able to play on the TV as well.,5.0,positive
"January 7, 2020",Switch,"Used it for a game, the game was disappointing so I got another and was happy with it, at least somewhat.Help me I’m trapped while my dad is mad at me in the basement",5.0,positive
"January 7, 2020",FORTNITE,So far we love everything about it.,5.0,positive
"January 7, 2020",Like it,Very good purchase except for the price. Hahhhhhhhhh,5.0,positive
"January 7, 2020",My son loves this.,Gaming system is awesome.,5.0,positive
"January 7, 2020",Disappointed,Part came in and immediately displayed error codes.  I had to order a replacement.,1.0,negative
"January 7, 2020",Fun for the whole family!,"Over the holidays had adults, teenagers, and kids all playing at the same time. What a great experience for all involved!2 games are absolute musts:Mario Kart & Smash Bros",5.0,positive
"January 7, 2020",Great product,We are so far very impressed with our purchase of the Nintendo Switch. It's great for the entire family.,5.0,positive
"January 7, 2020",Excellent console,Awesome quality and fun to play. My daughter enjoyed like anything.,5.0,positive
"January 7, 2020",Quality,Son loves it.  Uses it all the time.  So far it's still working.,5.0,positive
"January 7, 2020",It works,Good times,5.0,positive
"January 6, 2020",Awesome product,Awesome product. Wish a game was included too.,5.0,positive
"January 6, 2020",Fun anyware,"Great console, the flexibility to use attached or portable is amazing.The kids loved their new console.",5.0,positive
"January 6, 2020",Great!,My son really seems to love it!,5.0,positive
"January 6, 2020",best purchase of 2019,love it,5.0,positive
"January 6, 2020",Great,Great,5.0,positive
"January 6, 2020",Viability,Christmas gift.  It was loved.,5.0,positive
"January 6, 2020",Muy bueno,Excelente,5.0,positive
"January 6, 2020",Feliz con mi Nintendo!,Lo mejor de lo mejor! 😼,5.0,positive
"January 6, 2020",Good system. Would buy again.,Love the system. Up and playing in 5 minutes. Graphics great. Battery life good.,5.0,positive
"January 6, 2020",Amazing!,Eveything works perfect,5.0,positive
"January 6, 2020",Product perfect,"Purchased for my son for Christmas. Delivered quickly, product perfect!",5.0,positive
"January 6, 2020",Great product. But buy a case and a micro SD,"Great product. Ordered it in the morning, 5 hours later was at my door. We live in beautiful times.Definitely recommend getting a Switch with colored joycons like this one, the black ones are dull and these Red/Blue ones retail for up to $80. Comes with everything you need except a carry case (which I would recommend instead of putting in your backpack lose) as well as picking up a good sized Micro SD card. I got like a 200gb one for $30-40 so I will never lose one of the tiny came cartridges.It's light weight and feels a little fragile, but not cheap feeling. Just wouldn't recommend dropping it like EVER. Anyway, great for all ages like 8-99yo. Bright screen, kick stand is a pain to open at first, but I've used that part like 2 times in 3 months.All n' all, would recommend!",5.0,positive
"January 6, 2020",Love,My daughter loves loves loves this.,5.0,positive
"January 6, 2020",Granny can play Switch too,Purchased for myself and meets all my expectations.,5.0,positive
"April 24, 2020",Really fun.,Best console out.,5.0,positive
"April 24, 2020",RIP off,RIP off. Don't let these guys price gouge you. I can't believe Amazon allows this mess.,1.0,negative
"April 24, 2020",Dont support the individual sellers,They're getting bots to buy up all the the switches and inflating the prices.,1.0,negative
"April 23, 2020",It's A Switch What Else Can I Say,Exactly as advertised. I have had issues with Amazon shipping delivering used when bought new so during this crisis I was worried but not any longer. I've had it for almost 23 days and as it stands its working as intended and was in fact brand new. So glad I got lucky during these times.,5.0,positive
"April 23, 2020",Stop ripping people off!,This is too darn expensive! Please lower the price! This is a hard time and is very unacceptable!!!!,1.0,negative
"April 23, 2020",Perfect Condition!,"Product came the first day of the projected arrival timeframe which was an exciting surprise! Packaging was USPS in a sturdy USPS box and taped very well with ""do not break seal"" type packaging tape which I really appreciated. Product came as advertised in Nintendo box, brand new, all main gaming system components and accessories still in plastic wrap and scratch resistant wrap. I'm very very happy with this purchase!! It was purchased as a gift to a family member as a way to help with the stress of all that's going on and I couldn't be happier with my order! Thank you!",5.0,positive
"April 23, 2020",Great game console,Gray item my niece loves it,5.0,positive
"April 23, 2020","Good, arrived on time.",Good.,5.0,positive
"April 23, 2020","Device 5 stars, software and website zero stars","Cool toy and my child loves it. However, for a child to use it, you MUST make your own Nintendo account as well as a child account, download the app to set some parental controls, then use their website to set another round of parental controls. Really poorly designed and not intuitive. For example, when making an account, it allows you to use Google, Facebook etc instead of setting a unique Nintendo password. Convenient! However, you can’t buy anything without a parental password, so once you get father along and try to download something, they forgot about the Google sign in and you need to go back to the beginning and set up new Nintendo password for the parent. I would return this hunk of junk if it would make my kid have a tantrum.",3.0,negative
"April 23, 2020",Price gouging is dumb,"This price gouging has to stop. You think it's cool to raise the price to something ridiculous during a global pandemic? Because of supply and demand?? That's some crap. I mean amazon itself is run by a terrible person who doesn't care about his employees and I should expect ya'll to allow this because of that. No one is gonna buy from you at such a ridiculous price. I am so fed up with people using bots to buy out the new stock that comes in with these. You think a normal person has 500 dollars to drop on a gaming console?  When the unemployment rate is at an all time high?? Seriously? 299 is already quite a bit to drop, but I'd consider it reasonable for what you are getting. 500 is over the top, maybe, MAYBE if it came as a bundle I could consider it. Thats a very very small maybe. People are dying and people are going nuts staying in their houses all the time. Let the console be the normal price.",1.0,negative
"January 6, 2020",It’s a switch,Perfect,5.0,positive
"January 6, 2020",Very Impressed!,"My son has wanted this for the past year.  Before that he wanted the DS.  I was able to hold out on the DS, but when he wanted the switch, it looked like more than just a portable gaming unit.  Saw it at a friends house and was impressed with how you can just drop it in the dock and it will work on the TV.  So much better than having your kids playing on the small screen the whole time.I still was able to avoid getting it until this year.  After hearing much regret from fellow parents, I caved in, but set very strong ground rules.  So far so good.  Hasn't gotten too immersed into it and understands if he doesn't put it down the first time we ask, it will disappear for a few weeks.The unit itself is very impressive.  I like how the  joycons can be used as a single player and then split into two for a 2 player game.  I plan to get one more pair so that we can have 4 small joycons for family play.Overall I would recommend but for young kids 10 and under set strong ground rules.  No playing school days.  Only Fri-Sun AFTER all work/homework is done.  maybe 1 or 2 hrs max per day on the weekend.  AND any time the rule is broken, the switch will disappear for an unknown amount of time!",5.0,positive
"January 6, 2020",Excelente,Excelente,5.0,positive
"January 6, 2020",Great product,Got this for my sister for Christmas and she loves it,5.0,positive
"January 6, 2020",Recomendado,"Me gustó mucho, los gráficos son buenos, pero la memoria interna debería tener más espacio, si o si es necesario adquirir una tarjeta SD",5.0,positive
"January 6, 2020",Don’t waste your money,"This thing is absolute garbage for how expensive it is. I’ve had to send it to nintendo to get fixed only after a month. It’s handled very carefully , has a screen protector, case and everything basically only gets played while on dock. The sound went out....it takes forever to charge and battery life is horrible on this thing. If you use a charger from anywhere else, it barely works. And a new one is $30 and ridiculously bulky. Games are wayyy too expensive. This could have been GREAT....but it’s not",1.0,negative
"January 6, 2020",Great gaming system!,"Love our Nintendo Switch!  Easy to use, fun for hours.  This is the newer version with the better battery life.",5.0,positive
"January 6, 2020",Expected Nintendo quality,Expensive but excellent product,5.0,positive
"January 5, 2020",.,love,5.0,positive
"January 5, 2020","Quick shopping, product as advertised.","Shipping was quick, the switch has been great so far. Got this for my son and he loves it.",5.0,positive
"January 5, 2020",God,God,5.0,positive
"January 5, 2020",Alot of fun,Playing games 🤔,5.0,positive
"January 5, 2020",Love it,I love it. I bought it as a present to myself for my birthday and I love to play it,5.0,positive
"January 5, 2020",Another sweet console,"It's as you would expect another lovely console by Nintendo. It's great for family and friend gatherings but is also fun for solo play. The downside that differs from other consoles is the little space it has, I recommend buying a SD card when you buy the console. The little space does make sense though, since a lot of the games dont take up much space at all.",5.0,positive
"January 5, 2020",Fast delivery no damage,Works great. No damage to box or product. Fast delivery.,5.0,positive
"January 5, 2020",Awesome Christmas gift,Daughter uses this and loves it.,5.0,positive
"January 5, 2020",You have to purchase most games that are enjoyable for this price NO WAY,"The game works fine, it's just that all things wanting to play they have to purchase so no after paying this much for the thing I would not do it again.",3.0,negative
"January 5, 2020",Kids love it a favorite in our house!,Great product! Kids love it!,5.0,positive
"January 5, 2020",Great !!,Great game system!,5.0,positive
"January 5, 2020",Great!,It’s great!,5.0,positive
"January 5, 2020",So much fun!,I use it to play and have fun. I like that it keeps me occupied. I like everything about it. - my 9 year old.,5.0,positive
"January 5, 2020",Perfect for Introverts!,"My kids left us alone the whole Christmas break! Plus, it’s got games for the whole family. Plus plus, I can use it as a hand-held console in the bathroom!",5.0,positive
"January 5, 2020",A worthwhile purchase with hours of fun for the whole family,"I took a break from gaming consoles before I got this. My last home system was a PS3 and my last handheld was a Nintendo DS. I couldn’t find any games I was really into or anything that seemed worth my time. I got the Switch after having seen my friends using it and after a few minutes of playing Breath of the Wild. Let me tell you.... this system is wonderful!! You’re really getting two systems in one!! Being able to play on the go as well as just plug and play is such a wonderful concept. Not to mention the game options and variety. I’ve played over 70 hours of Breath of the Wild, and loved it. The other indie games available are also great additions. Overall, it’s a great system. Worth every dollar. I haven’t had this much fun with a gaming system in a while. Great job, Nintendo!!!",5.0,positive
"January 5, 2020",Switch is Fun!,"Enjoy playing the Switch, I been playing Pokemon Shield & Super Smash Bros Ultimate! Hoping to play Fire Emblem: Three Houses!",5.0,positive
"January 5, 2020",Might just buy one for myself!,Bought this as a gift and we are very satisfied with our purchase. Shipping was fast and everything was perfect. No complaints! Thank you.,5.0,positive
"January 5, 2020",Nintendo Switch,Great system. My daughter loved it.,5.0,positive
"January 5, 2020",Switch,"I really enjoyed my switch, it came when it was suppose to my grandkids love it. Thank you Amazon. I love you guys",5.0,positive
"January 5, 2020",Best purchase I’ve made in a long time!,The switch is just amazing! And I’m having a hard time to stop playing it!,5.0,positive
"January 5, 2020",Great,Great game,5.0,positive
"January 5, 2020",30 dollar credit??,When I purchased this there was a 30 dollar credit I was supposed to receive?? Can someone explain. Else wise all is perfect,5.0,positive
"January 5, 2020",Disappointed,Had to return the unit 2 times now the dock won't display a image on the TV. Hoping they get it fixed this time,1.0,negative
"January 5, 2020",Successful present,Perfect Christmas present for my fiance. No problems and hes enjoying the extended battery life compared to my switch which is the older model.,5.0,positive
"January 5, 2020",Always get the warranty,My neice who has severe adhd loved the switch. It will help her concentration hand eye coordination in college.,5.0,positive
"January 5, 2020",promo,Where is my 30 dollar promo gift card,1.0,negative
"January 5, 2020",Great gaming system,I bought this gaming system for my fiancé’s birthday and he loves it !,5.0,positive
"January 5, 2020",Must have!,"We bought this as a Christmas gift for our 6 year old son. He absolutely loves it, as do we! Haha. It came packaged very well and works wonderfully. My son loves the fact he can play it on the tv or take it with him on the go! Well worth the purchase!",5.0,positive
"January 5, 2020",Good buy,"Xmas gift for Grandson , he loves it",5.0,positive
"January 5, 2020",My son loves it!,It came very fast and in good shape. Can’t keep my son off it!,5.0,positive
"January 5, 2020",Great design and value,Bought as a gift for my 14 yr old grandson. He loves it.,5.0,positive
"January 5, 2020",Wonderful,🤗🤗🤗🤗🤗🤗🤗my son can’t put it down. Great for in the house and on the road,5.0,positive
"January 5, 2020",Did not work,"I bought a ""like new"" Switch from Amazon Warehouse that was missing parts and the console itself did not work. Immediately returned.",1.0,negative
"January 5, 2020",Great little system.,Christmas for the kids. They are very happy with it,5.0,positive
"January 5, 2020",The switch,Its works awsome entertainment system.,5.0,positive
"January 5, 2020",My favorite thing ever,I love the switch.,5.0,positive
"January 4, 2020",Excellent,Excellent service. Very pleased,5.0,positive
"January 4, 2020","It's me, Mario. :-)","Delivered quickly, just as expected.",5.0,positive
"January 4, 2020",Great battery,Great purchase. The battery really lasts longer,5.0,positive
"January 4, 2020",Love it,"Love the new switch! I got it got Christmas just for Pokemon. Works like a dream, easy set up. Making multiplayer gaming great again.",5.0,positive
"January 4, 2020",Awesome,Love it,5.0,positive
"January 4, 2020",Love it!,We got the Nintendo Switch as a Christmas gift for our girls and they’ve loved it.  Once we realized that there was a first and second generation we are glad to have spent the extra money to get the second generation because a longer battery life is definitely worth it.,5.0,positive
"January 4, 2020",Right Joycon noise,"Came with everything, packaged nicely, console and games run great, but my right joycon the the very top bumper makes a very metallic noise rather then a nice clean click. Didn’t really notice it till later when I was just listening to the button noises.",4.0,positive
"January 4, 2020",Must have,Very happy satisfied son.,5.0,positive
"January 4, 2020",Fun!,Bought for my son for Christmas. Quick delivery and works great,5.0,positive
"January 4, 2020",Lots of fun,Great gift!! Perfect to be able to take on the go or use at home.,5.0,positive
"January 4, 2020",Amazon needs to give people health insurance.,Ya know what Amazon keepsMaking me write I’m not reviewing anything anymore. 5 stars wadderya need to know?,5.0,positive
