"May 11, 2020",Over priced!,THIS IS WAY OVER PRICED! Shame on you!,1.0,negative
"May 11, 2020",Price gouging,"Definitely price gouging, wouldn't buy",1.0,negative
"May 11, 2020",Pole smokers,"Great product but wait till it’s back in store before buying,don’t give none of these price gouging pole smokers any of your money",1.0,negative
"May 11, 2020",Used and overpriced... makes no sense.,Please stop,1.0,negative
"May 11, 2020",Great product from nintendo,i Loved how portable this console is and how kid friendly it is ❤️ . I got it for my little cousin and he loves it ! Great product from nintendo !,5.0,positive
"May 10, 2020",Amazing Product!,Love my Nintendo Switch. It's just so fun and portable. Everyone should have one honestly!,5.0,positive
"May 10, 2020",Seller is the scum of the earth,Raising the price this high should be a felony a Nintendo switch is worth $300 tops. Waiting for a pandemic where people are stuck inside to raise the price of one of the most sought after devices on the market means your just the greediest human you could possibly be and I hope you get sued and go bankrupt,1.0,negative
"May 10, 2020",Love my Nintendo Switch! ❤️,Arrived to my house so fast. Ordered 4/30 & arrived 5/6. It was pre order as these have been sold out for a while. Perfect to occupy myself with.,5.0,positive
"May 10, 2020",Perfect gift for my little godzilla....,Thank you so much!!! My son loves it!!,5.0,positive
"May 10, 2020",Love this switch,Awesome little game since i am on house arrest!!,5.0,positive
"April 27, 2020",Price gouging,530 for a product that is normally 299 is not ok especially when it’s used .....,1.0,negative
"April 26, 2020",rip off,Assholes taking advantage of people with over priced product,1.0,negative
"April 26, 2020",Joy con doesn’t fully attach,I love it only thing is one of the joy cons doesn’t snap it.,4.0,positive
"April 26, 2020",Great item,Love the item. Got it for my son.,5.0,positive
"April 26, 2020",Extortion,Trying to profit from covid-19,1.0,negative
"April 26, 2020",Ns ❤️,I love it ❤️,5.0,positive
"April 26, 2020",Nice gift,My grandson was so excited to get this.,5.0,positive
"April 26, 2020",Wrong Joy-Cons,The switch works great but I did order the gray joy-con option and it came with the original blue and red ones. Not terrible just disappointed.,3.0,negative
"April 25, 2020",Worst Console I’ve ever bought.,"This is the worst console I’ve ever bought, everything was fine until I had to go out of town due to work. Some genius thought it as a great idea not to add a web browser into this stupid console. So I’m at my hotel that requires a web browser to enter guest info to use the internet and I can’t do it on the god dam device. Thank god I have my PS4 with me because atleast Sony was smart enough to add it into their system. Whoever thought it was a smart idea to remove it when past Nintendo systems had it needs to get fire if they are still at the company. Because this stupid issue beats the whole point of the god dam console, the on the go system is now worst than the PS4 & Xbox because atleast they can be almost on the go as long as you have power & a screen for them.",1.0,negative
"April 25, 2020",Vale 100 % su compra,"Siempre fui #Fan de otras consolas y quería un cambio para complementar mis días libres, al principio dude en comprarlo por la variedad de juegos! sin embargo, cuenta con muchos clásicos y otros nuevos para no perder nunca la diversión.  Vale demasiado su compra, que quizá el precio podría ser elevado y sus juegos dependiendo el formato pero la compra lo vale. Si compras los accesorios para viajar y protección del mismo tendrás más comodidad para poder utilizarlo sin ningún problema en  cualquier lugar y solo o acompañado de gran entretenimiento",5.0,positive
"January 15, 2020",My nieces absolutely love it,"I bought this as a Christmas present for my nieces who are 6, 8 and 8.  They were so excited and play it all of the time.",5.0,positive
"January 15, 2020",Awesome,"Family loves it, just as described.",5.0,positive
"January 15, 2020","Easy, fun and portable",Love the System,5.0,positive
"January 15, 2020",best gift,both boys received this for christmas and love it they havent stopped playing it.,5.0,positive
"January 15, 2020",Great product,"I bought it for my son, he loves it and is enjoying it",5.0,positive
"January 15, 2020",It's a Nintendo,"Thx amazon for the promotional code included... However, you can't apply the promo to the online code purchase.",4.0,positive
"January 15, 2020",good,this was a gift....they loved it!,5.0,positive
"January 15, 2020",Fun,Good times. Buy physical copies of games.,5.0,positive
"January 15, 2020",Best XMas gift ever!,It was a XMas gift for my nephew and he loooved it!,5.0,positive
"January 15, 2020",So much fun!,"Love my Switch. I haven’t used it on my TV, but as a portable device, it’s awesome.",5.0,positive
"January 15, 2020",Favorite Console,"Prior to purchase, I knew that the Switch was an awesome platform. After purchasing one, it has quickly become my favorite console. The user experience is fantastic, and the game selection is diverse. Playing with friends is super easy, and I would completely recommend this version over the lite since you can remove the joycons.",5.0,positive
"January 15, 2020",Love!,Just What I Wanted,5.0,positive
"January 15, 2020",Most versatile console,New switch model with better battery life than the original. Being able to play any games in handheld or your tv makes this the most versatile console I've ever owned.,5.0,positive
"January 14, 2020",Great,Great,5.0,positive
"January 14, 2020",Battery life is awesome,Great Nintendo product,5.0,positive
"January 14, 2020","Great, versatile gaming system","This system is awesome! I love that it can be carried around and used as a personal game system or I can pop it into its dock and play on a big screen. It's extremely easy to set up, to use, and to play.I bought the year long Family Subscription to Nintendo Online and each of my kids has their own profile. They can take turns playing alone, or quickly jump in on a shared game. We even got my wife involved once I bought Monopoly from the Nintendo Online Store. I highly recommend the system for any families or anyone who enjoys all levels of gaming",5.0,positive
"January 14, 2020",New Switch and Perfect.,Just wanted to mention these are indeed the new switches. Codes are right and everything. I got the gray and it's lovely. Would recommend buying a screen protector and hard case like mine for storage.,5.0,positive
"January 14, 2020",Aunt JoJo outranks Santa now,Nephew LOVED and so did parents as there’s less fighting over all the devices. All kids can play in the house now.,5.0,positive
"January 14, 2020",NO LLEGO NUNCA,Nunca me llego este paquete! En lugar de esto me vinieron unos vasos de plástico!!!! Por favor que alguien se comunique conmigo,1.0,negative
"January 14, 2020",Easy to carry,Work great,5.0,positive
"January 14, 2020",Portable n working on TV and long battery life,Portable n easy installation,5.0,positive
"January 14, 2020",Great,Grandson loves it,5.0,positive
"January 14, 2020",Tiempo de entrega,Excelente descripcion del producto,5.0,positive
"January 14, 2020",Excelente,A mis hijos les encanta y a mi también!!!,5.0,positive
"January 14, 2020",Everyone love,We all love this ...my daughter can take it on the road to play but we can also hook it up to the TV so we can all play....great gift definitely worth the price,5.0,positive
"January 14, 2020",it's a Nintendo Switch,it's a Nintendo Switch,5.0,positive
"January 14, 2020",Good fun,Huge hit with the family,5.0,positive
"January 14, 2020",Nice system!!!,My son loves it. Me and my husband also enjoy playing this system.,5.0,positive
"January 14, 2020",Great,Works great and didn’t have any issues,5.0,positive
"January 14, 2020",Flawless purchase,Flawless purchase,5.0,positive
"January 13, 2020",After 10 years the Wii has retired,"Wow, Nintendo has again leapfrogged the market, hit a niche like the Wii.We bought the Wii for the kids (and the parents) 10 years ago.  Other than replacing some game discs that stopped working due to overuse the Wii has been the best buy ever.I believe we have the same winner with the Nintendo Switch.  Not only do we have all that we had in the Wii, but we have mobility, versatility and more importantly we have a store and digital content that is buy once and own forever.",5.0,positive
"January 13, 2020",💙💙💙,💙,5.0,positive
"January 13, 2020",GOOD SYSTEM,I HAVE ALL THE SYSTEMS AND THIS ONE IS REALLY NICE AND GIVE YOU MORE OPTIONS WITH BEING ABLE TO TRAVEL WITH IT.,5.0,positive
"January 13, 2020",Switch,It's good,5.0,positive
"January 13, 2020",Works great,Too spendy,5.0,positive
"January 13, 2020",It's Nintendo's newest generation console - you know what this is.,"I'm mainly going to list off the pros for this unit, something I like that they did on this generation compared to the other consoles by Nintendo and some gripes.Portability obviously with its docking capabilities - very good move.  The way the Switch locates itself within the dock is a cool party trick.  I like not having to have a rucksack full of gear just to bring my system with.The Joy-Con controllers are passable and you can actually play 2P games with each one.  I do wish they offered a Pro-controller bundled version.The setup of the system is easy, you don't have to fill out another mortgage worth of EULAs to play.For pennies you get a slew of NES and SNES games through Nintendo Online.Mario Maker 2 is pretty fun and I wished more games had BYO levels like it(cue the wave of gamers that will correct me on 20+ games that have their own world-building options. I'm 43 and don't have time for games like I did in my teens.  Let me dip my filthy casual toe back in the game pool now that my kids are grown.)",4.0,positive
"January 13, 2020",Loved it!,This was a Christmas present for our 6 year old. He has loved it!,5.0,positive
"January 13, 2020",Great product,GREAT PRODUCT. (I love Link.),5.0,positive
"January 13, 2020",Muy bueno,Excelente.,5.0,positive
"January 13, 2020",Fast shipping,Shipping time was outstanding and as described,5.0,positive
"January 13, 2020",Joycon,The right joy cons vibration isn’t equal to the left and the left joy con acts up sometimes but it’s barely noticeable,4.0,positive
"January 13, 2020",You get what you pay for: excellent,"A tremendously well designed platform for gaming. I do wish it had more educational abilities so I could blend both education and gaming for my nephew. But given its design intentions, it met all of them spectacularly well! Truly an amazing achievement. Would be nice if it were less expensive.",5.0,positive
"January 13, 2020",Great!,"My son loved it! I played with it so much, I bought a second one for myself lol.",5.0,positive
"January 13, 2020",It’s worth the high cost,Loved by gamer!!!  Portable,5.0,positive
"January 13, 2020",Grandsons love it.,It’s not cheap but it served well as the sole present for my grandsons ages 5 and 7.  It also promotes them working together instead of arguing.  All in all a good gift.,5.0,positive
"January 13, 2020",Great,At first time it didn’t work and I returned and ask for a replace but now it works really great mi daughter love it,5.0,positive
"January 12, 2020",Muy recomendable,Muy bueno Gracias,5.0,positive
"January 12, 2020",Good system good games bad priced games,I lile to be able to take my switch anywhere but I dont like how expensive all the games are that's my only complaint,5.0,positive
"January 12, 2020",Nostalgia,Brings back childhood memories. My 4 year old loves it. We often play together.,5.0,positive
"January 12, 2020",Good product,"Takes me back to my nitendo days! I just wish it wasn't so expensive!!! Games are $50 each,  extra joycons are $60..... I'm hoping the durability makes up for the huge price tag!",5.0,positive
"January 12, 2020",So nice,Extremely nice and compact gaming console. Well made and nice to game at home or on the go,5.0,positive
"January 12, 2020",No,Good for playing on the Nintendo switch,5.0,positive
"January 12, 2020",Great purchase,"I bought this for my nephew, and it had everything he needs to connect it to the TV or to play himself. He is so happy! Fast shipping and a smooth transaction",5.0,positive
"January 12, 2020",5 stars,"Great product food price, and always love prime shipping!",5.0,positive
"January 12, 2020",Great system,Everything looks / works great except I'm having to send the left joycon to Nintendo for repair already... ot was acting up 3 days after we got it.,4.0,positive
"January 12, 2020",Works great,I bought this as a Christmas gift. My son loves this!,5.0,positive
"January 12, 2020",👍🏾,👍🏾,5.0,positive
"January 12, 2020",Amazing Console.,Great Console and brings back childhood memories.,5.0,positive
"January 12, 2020",First time gamer,"An awesome console. Love the portability and simplicity. I was never really a gamer, so I was scared of getting a console but this ones amazing for first time gamers.",5.0,positive
"January 12, 2020",Great,Great,5.0,positive
"January 12, 2020",i like it,i like it',5.0,positive
"January 12, 2020",Awesome delivery time,Loved the delivery time thanks guys your awesome my son was very happy he didn't had to wait a whole month,5.0,positive
"January 12, 2020",Much better than stupid Xbox,"It is so much easier to play then Xbox, much better for kids to play.",5.0,positive
"January 12, 2020",Wonderful present.,Great system! Shipped as expected!,5.0,positive
"January 12, 2020",Fun to play,I bought 3 for the grandkids. There are enough free/cheap games to keep them happy. Online parental controls are really nice.,5.0,positive
"January 12, 2020",Awesome,Took a while to get to me but great!,5.0,positive
"January 12, 2020",Worth it,Everyone in the family approves!,5.0,positive
"January 12, 2020",Great,Love it,5.0,positive
"January 12, 2020",Great present,Good deal,5.0,positive
"January 12, 2020",Switchreview,My kid can not out it down!! I esspecially like it because as a parent I am able to control his playing time!,4.0,positive
"January 12, 2020",2019 Christmas gift,Purchased it for my 17 yr old Granddaughter & she seems to love it,5.0,positive
"January 12, 2020","Nintendo Switch ,nice multi purpose item.",It does what its suppose to do and keeps charge well.,4.0,positive
"January 12, 2020",Lo maximo,El producto era para el sobrino de mi esposa y le encanto,5.0,positive
"January 12, 2020",as expected,"I ordered thus product to be shipped in UAE. The product is fine and working well, however, I will never order such kind a products to be shipped to UAE, due to tax fees",5.0,positive
"January 12, 2020",Happy Clicky Snappy,The switch is such a satisfying console to deal with. All clicky and snappy. Plus it has Super Smash Bros Ultimate so there's that too!,5.0,positive
"January 12, 2020",Great system for the Mario lover and more,Great casual gaming. I suggest hunting down the physical disks over utilizing the Nintendo store if she'd like to maximize your dollar value in a long run. If you have large hands I'd also suggest getting a remote control that fits your hands. I like that the switch has so many options available of controllers. all of the players in my house have been able to find forms that are comfortable for them. As a huge Mario fan there's no other place for me to get these titles. the biggest hit on the system is that many of the streaming services do not have applications or programs available at this time which is just strange to me.,5.0,positive
"January 11, 2020",Great,Bought  this for my grandsons Christmas gift.  He loved it! Works great!,5.0,positive
"January 11, 2020",Have your 13 year old set up for their father!,Great game. Good but.,5.0,positive
"January 11, 2020","For $300 dollars, I would expect better quality...","My grandson loves the game but one of the buttons on the joystick fell off after 3 weeks... I am sending it back and they are sending a new one,  so hopefully the new one will be good... concerned about the quality... it was $300, I certainly hope the replacement will be good!",3.0,negative
"January 11, 2020",Well done,Everything that was described was included and delivered on time. All parts and machine work and had no Damages to the box (which should probably be a review for UPS),5.0,positive
"January 11, 2020",Be careful!,"Onr of the controllers came in damaged.  My kids could not wait for repairs, so I reordered a new set of joy con controllers.  Should have been given to me instead.",1.0,negative
"January 11, 2020",Just get it!,Daughter loves this.  Best system ever,5.0,positive
"January 11, 2020",Good times,Our Kids love it,5.0,positive
"January 11, 2020",Do it,5000% worth every penny.,5.0,positive
"January 11, 2020",Great for any age!,Love this! I hate video games yet I have played and actually enjoy it! I bought for my 12 year old daughter but had to buy 2 more controllers as my 3 and 4 year old boys play as well! Didn’t think they would be able to but they love it and actually comprehend how to play! Great game for the family and for all ages! Little kids and adults! Even my mom (grandma) played along!,5.0,positive
"January 11, 2020",DEAD AFTER 1 MONTH,I purchased this product for my 23 yo son on December 1st and it already won't hold a charge.  It seems to me that this particular switch is faulty but Nintendo won't honor the warranty because it was purchased through Amazon.comI'm very disappointed to say the least.,1.0,negative
"January 11, 2020",Exactly what I ordered,Everything was perfect,5.0,positive
"January 11, 2020",Amazing gift,My kids were waiting for it to come all night,5.0,positive
"January 11, 2020",MINECRAFT LOVERS BEWARE!,"Minecraft lovers beware! We bought this system two years ago, because they had released minecraft for the switch that year and my son loves minecraft. I have always loved Nintendo products and feel as if they are more suitable for children. With that being said, this system has been nothing but a headache from the get go! The game is glitchy, won't load, or constantly shuts off mid-game. Nintendo has to know the Minecraft game is this way because its been this way for two years with no improvement. We have played on other systems with no problem. We have also had problems with our joy con controllers. The joy stick on both gets stuck in forward and its a pain to get them to connect to the system EVERYTIME! It even doesnt want to connect to it when you slide into the sides to play on the go. Needless to say I feel let down by Nintendo and feel this product is very poorly made. Controllers are also very expensive for this sysyem to not last longer than they did! Don't buy just go with a different system! Unless your child loves mario just buy a different system.",1.0,negative
"January 11, 2020",Perfect gift,Bought this for my sone as a gift and he absolutely love it. He likes it so much and due to detachable controller he play the games with me. He likes it and I like it too. Perfect for gifting your loved ones.,5.0,positive
"January 11, 2020",Great,You can play lots of games,5.0,positive
"January 11, 2020",Love it,Best thing ever. Games are awesome.,5.0,positive
"January 11, 2020",Great definition and intuitive to operate.,I don't have to talk to or engage with my kids anymore ever since I bought this. It's a game changer for any parent.  Just be sure to limit your kid's time on it so they don't develop a hunch back.,5.0,positive
"January 11, 2020",Highly recommend,Just as described. Highly recommend,5.0,positive
"January 11, 2020",Awesome product,"Works great, Kids love it!",5.0,positive
"January 11, 2020",⭐️⭐️⭐️⭐️⭐️,Nothing to dislike! Great product at at great price.,5.0,positive
"January 11, 2020",This gadget is so popular with the millennial!,"My daughter just loved this Nintendo switch, nice color too! She’s hooked playing with the game she liked, once she’s starts she don’t want to stop!",5.0,positive
"January 10, 2020",GREAT BUY,Beautiful switch runs smooth. Box came in perfect conedition.,5.0,positive
"January 10, 2020",Nintendo switch,Nice product,5.0,positive
"January 10, 2020",I want my Nintendo,I am depressed : ( bought this to help my Sadness and now I feel like I am going to hit a nervous breakdown,1.0,negative
"April 25, 2020",Works for 6 months then unresponsive,After 6 months my Switch is unresponsive. Have tried all the recommended fixes and still nothing. If you want a $500 dollar toy that works for a few months then this is your toy.,2.0,negative
"April 25, 2020",WAIT TO BUY THE SWITCH!,"Price gouging at its finest...Folks, don't waste your time and hard earned money on those who look to rip people off during a pandemic. Nintendo will be releasing them again soon at the normal price of $299.00. The people looking to pawn these off are probably the same people with a garage full of hand sanitizer and toilet paper rolls. Let their surplus of Switches stagnate like 40 boxes of a failed MLM campaign.",1.0,negative
"April 25, 2020",minor problems but all right,"didn’t come in the original box, had a few scratches on the dock not worth the jump in price but that’s what u get for buying it off someone else  :( on the bright side it still works and came faster than expected",3.0,negative
"April 25, 2020",fast delivery with no issues,happy with the purchase,5.0,positive
"April 25, 2020",Keeping the wife happy during quarantine,"Works like a charm, more spendy but the wife was happy",5.0,positive
"April 25, 2020",Prices for switches are too high,im Never spending my hard earned money for scalpers on switches that are over the price,1.0,negative
"April 24, 2020",Bs,This is bs why sell it for like 500-1000 bucks like wtf this is so unfair no one is made out of money and can afford 500 $$ switch,1.0,negative
"April 24, 2020",520 dollars!!?? 😂,"520 dollars?! Lmao. You gotta be kidding me. I just searched switch to see if people really were selling them this high...I just bought one for 300, 4 weeks ago and I get the pandemic is happening but 520 dollars... man I hope nobody buys this haha but if u got the money then go for it but if I were you I'd wait a while until their 300 again.",1.0,negative
"April 24, 2020",Fun for all even those that say they don't like games,Love that we can play it on the big screen amd then take it on the go. The game options are great for all levels of gaming especially for me as a mother who doesn't care for many games. Love that it is multiplayer. Only complaint is the joy stickes eventually wear out and need to replace the controller. Other then that its recommended to all.,5.0,positive
"April 24, 2020",A+,"Arrived quickly and was as described, thank you!",5.0,positive
"January 10, 2020",Me encanto,"Me encanto, excelente calidad!",5.0,positive
"January 10, 2020",Good with lots of room for impovement,"Great idea, and being able to play on the go is my primary reason for buying or. Using the joycons is awkward and uncomfortable. I bough the Hori replacements which much better ergonomics. I also really wish it had a slightly bigger screen. Many things become incredibly difficult to see details on the screen.",4.0,positive
"January 10, 2020",Amazing,Love it. the switch is what I needed,5.0,positive
"January 10, 2020",Se disfruta todos los días,Excelente,5.0,positive
"January 10, 2020",Easy to use,My son loves it,5.0,positive
"January 10, 2020",Awesome,Great product as expected fast shipping.,5.0,positive
"January 10, 2020",Great buy!,"Xmas gift for my son, and he loves it!",5.0,positive
"January 10, 2020",Worth it,Perfect gift for my girlfriend. Worth every penny for the surprise and smile,5.0,positive
"January 10, 2020",Great fun,It’s daughter loves it,5.0,positive
"January 10, 2020",The Switch,The boys seem to love it.,5.0,positive
"January 10, 2020",Better battery life,"More playtime, fun console and great games.",5.0,positive
"January 10, 2020",GAMING MADE EASY,I Love the ease OF SET up. Just plug and play. This was GIVEN TO OUR eldest GRANDDAUGHTER AS A Christmas Gift.,5.0,positive
"January 10, 2020",Usability,Liked very much,5.0,positive
"January 10, 2020",Execelent!,Execelent,5.0,positive
"January 10, 2020",Not bad!,good,5.0,positive
"January 10, 2020",made for a great Christmas present for my daughter,great shipping service,5.0,positive
"January 10, 2020","Very disappointed, won't charge after 1 week",Very disappointed. Used it for a week and now it won't charge on its base or directly with the ac adapter cord. Will be returning,1.0,negative
"January 10, 2020",Delivery,"Muy buen servicio, excelente producto, perfecta hora de entrega del paquete.",5.0,positive
"January 9, 2020",love it,came exactly how it should,5.0,positive
"January 9, 2020",A lot of fun,"Nintendo does it again. Ever since the original NES, they make fun system and games for all ages",5.0,positive
"January 9, 2020",Nice,Super birn,5.0,positive
"January 9, 2020",Great gift,Christmas gift for my grandson was a hit!He loved it!,5.0,positive
"January 9, 2020",Great quality and fun!,My grandson loves it ! Very happy!,5.0,positive
"January 9, 2020",Gift for grandson. He said he loves it!,Gift,5.0,positive
"January 9, 2020",Great,For my grandsons and they love it .I enjoy also  thank u.,5.0,positive
"January 9, 2020",Love it,Got this for my son for Christmas and he loves it!,5.0,positive
"January 9, 2020",Great,Great product for price. Easy to use as well as easy parental controls.,5.0,positive
"January 9, 2020",Amazing console,Couldn't be happier.,5.0,positive
